"7ZMBHGEK","journalArticle","2017","Herrera-López, Mauricio; Casas, José A.; Romera, Eva M.; Ortega-Ruiz, Rosario; Del Rey, Rosario","Validation of the European Cyberbullying Intervention Project Questionnaire for Colombian Adolescents","Cyberpsychology, Behavior, and Social Networking","","2152-2715, 2152-2723","10.1089/cyber.2016.0414","http://www.liebertpub.com/doi/10.1089/cyber.2016.0414","","2017-02","2020-06-05 08:02:53","2020-06-05 08:02:53","2020-06-05 08:02:53","117-125","","2","20","","Cyberpsychology, Behavior, and Social Networking","","","","","","","","en","","","","","DOI.org (Crossref)","","","","","","","","","","","","","","","","","","","","","","","","","","","","","","","","","","","","","","","","","","","","","","","","","","","","",""
"A626V3XV","journalArticle","2016","Jeromin, Franziska; Rief, Winfried; Barke, Antonia","Validation of the Internet Gaming Disorder Questionnaire in a Sample of Adult German-Speaking Internet Gamers","Cyberpsychology, Behavior, and Social Networking","","2152-2715, 2152-2723","10.1089/cyber.2016.0168","http://www.liebertpub.com/doi/10.1089/cyber.2016.0168","","2016-07","2020-06-05 08:02:55","2020-06-05 08:02:55","2020-06-05 08:02:55","453-459","","7","19","","Cyberpsychology, Behavior, and Social Networking","","","","","","","","en","","","","","DOI.org (Crossref)","","","","","","","","","","","","","","","","","","","","","","","","","","","","","","","","","","","","","","","","","","","","","","","","","","","","",""
"CV58SP2D","journalArticle","2019","Schaffer, Daniel R.; Debb, Scott M.","Validation of the Online Security Behaviors and Beliefs Questionnaire with College Students in the United States","Cyberpsychology, Behavior, and Social Networking","","2152-2715, 2152-2723","10.1089/cyber.2019.0248","https://www.liebertpub.com/doi/10.1089/cyber.2019.0248","","2019-12-01","2020-06-05 08:02:58","2020-06-05 08:02:58","2020-06-05 08:02:58","766-770","","12","22","","Cyberpsychology, Behavior, and Social Networking","","","","","","","","en","","","","","DOI.org (Crossref)","","","","/Users/dougaparry/Zotero/storage/YPC4L6IW/Schaffer_Debb_2019_Validation of the Online Security Behaviors and Beliefs Questionnaire with.pdf","","","","","","","","","","","","","","","","","","","","","","","","","","","","","","","","","","","","","","","","","","","","","","","","",""
"NWSGQDUR","journalArticle","2015","Donati, Maria Anna; Chiesi, Francesca; Ammannato, Giulio; Primi, Caterina","Versatility and Addiction in Gaming: The Number of Video-Game Genres Played Is Associated with Pathological Gaming in Male Adolescents","Cyberpsychology, Behavior, and Social Networking","","2152-2715, 2152-2723","10.1089/cyber.2014.0342","http://www.liebertpub.com/doi/10.1089/cyber.2014.0342","","2015-02","2020-06-05 08:03:01","2020-06-05 08:03:01","2020-06-05 08:03:01","129-132","","2","18","","Cyberpsychology, Behavior, and Social Networking","Versatility and Addiction in Gaming","","","","","","","en","","","","","DOI.org (Crossref)","","","","","","","","","","","","","","","","","","","","","","","","","","","","","","","","","","","","","","","","","","","","","","","","","","","","",""
"MJTNVQ5R","journalArticle","2015","Schmitt, Zachary L.; Livingston, Michael G.","Video Game Addiction and College Performance Among Males: Results from a 1 Year Longitudinal Study","Cyberpsychology, Behavior, and Social Networking","","2152-2715, 2152-2723","10.1089/cyber.2014.0403","http://www.liebertpub.com/doi/10.1089/cyber.2014.0403","","2015-01","2020-06-05 08:03:03","2020-06-05 08:03:03","2020-06-05 08:03:03","25-29","","1","18","","Cyberpsychology, Behavior, and Social Networking","Video Game Addiction and College Performance Among Males","","","","","","","en","","","","","DOI.org (Crossref)","","","","/Users/dougaparry/Zotero/storage/MG4F39MF/Schmitt_Livingston_2015_Video Game Addiction and College Performance Among Males.pdf","","","","","","","","","","","","","","","","","","","","","","","","","","","","","","","","","","","","","","","","","","","","","","","","",""
"PR9VUWEU","journalArticle","2012","van Rooij, Antonius J.; Schoenmakers, Tim M.; van den Eijnden, Regina J.J.M.; Vermulst, Ad A.; van de Mheen, Dike","Video Game Addiction Test: Validity and Psychometric Characteristics","Cyberpsychology, Behavior, and Social Networking","","2152-2715, 2152-2723","10.1089/cyber.2012.0007","http://www.liebertpub.com/doi/10.1089/cyber.2012.0007","","2012-09","2020-06-05 08:03:07","2020-06-05 08:03:07","2020-06-05 08:03:07","507-511","","9","15","","Cyberpsychology, Behavior, and Social Networking","Video Game Addiction Test","","","","","","","en","","","","","DOI.org (Crossref)","","","","","","","","","","","","","","","","","","","","","","","","","","","","","","","","","","","","","","","","","","","","","","","","","","","","",""
"5GM4P6T8","journalArticle","2012","Elliott, Luther; Golub, Andrew; Ream, Geoffrey; Dunlap, Eloise","Video Game Genre as a Predictor of Problem Use","Cyberpsychology, Behavior, and Social Networking","","2152-2715, 2152-2723","10.1089/cyber.2011.0387","http://www.liebertpub.com/doi/10.1089/cyber.2011.0387","","2012-03","2020-06-05 08:03:10","2020-06-05 08:03:10","2020-06-05 08:03:10","155-161","","3","15","","Cyberpsychology, Behavior, and Social Networking","","","","","","","","en","","","","","DOI.org (Crossref)","","","","/Users/dougaparry/Zotero/storage/TNB44TJ6/Elliott et al_2012_Video Game Genre as a Predictor of Problem Use.pdf","","","","","","","","","","","","","","","","","","","","","","","","","","","","","","","","","","","","","","","","","","","","","","","","",""
"H5JAVFVJ","journalArticle","2014","Collins, Emily; Freeman, Jonathan","Video Game Use and Cognitive Performance: Does It Vary with the Presence of Problematic Video Game Use?","Cyberpsychology, Behavior, and Social Networking","","2152-2715, 2152-2723","10.1089/cyber.2012.0629","http://www.liebertpub.com/doi/10.1089/cyber.2012.0629","","2014-03","2020-06-05 08:03:16","2020-06-05 08:03:16","2020-06-05 08:03:16","153-159","","3","17","","Cyberpsychology, Behavior, and Social Networking","Video Game Use and Cognitive Performance","","","","","","","en","","","","","DOI.org (Crossref)","","","","/Users/dougaparry/Zotero/storage/RJWKNW85/Collins_Freeman_2014_Video Game Use and Cognitive Performance.pdf","","","","","","","","","","","","","","","","","","","","","","","","","","","","","","","","","","","","","","","","","","","","","","","","",""
"NL8YBXJY","journalArticle","2013","Lam, Lawrence T.; Cheng, ZaoHuo; Liu, XinMin","Violent Online Games Exposure and Cyberbullying/Victimization Among Adolescents","Cyberpsychology, Behavior, and Social Networking","","2152-2715, 2152-2723","10.1089/cyber.2012.0087","http://www.liebertpub.com/doi/10.1089/cyber.2012.0087","","2013-03","2020-06-05 08:03:23","2020-06-05 08:03:23","2020-06-05 08:03:23","159-165","","3","16","","Cyberpsychology, Behavior, and Social Networking","","","","","","","","en","","","","","DOI.org (Crossref)","","","","","","","","","","","","","","","","","","","","","","","","","","","","","","","","","","","","","","","","","","","","","","","","","","","","",""
"Y8XL72VG","journalArticle","2018","Li, Bi; Wu, Yan; Jiang, Shengyi; Zhai, Huizhen","WeChat Addiction Suppresses the Impact of Stressful Life Events on Life Satisfaction","Cyberpsychology, Behavior, and Social Networking","","2152-2715, 2152-2723","10.1089/cyber.2017.0544","http://www.liebertpub.com/doi/10.1089/cyber.2017.0544","","2018-03","2020-06-05 08:03:25","2020-06-05 08:03:25","2020-06-05 08:03:25","194-198","","3","21","","Cyberpsychology, Behavior, and Social Networking","","","","","","","","en","","","","","DOI.org (Crossref)","","","","","","","","","","","","","","","","","","","","","","","","","","","","","","","","","","","","","","","","","","","","","","","","","","","","",""
"JIYL5USD","journalArticle","2017","Wiederhold, Brenda K.","What Predicts Facebook Addiction?","Cyberpsychology, Behavior, and Social Networking","","2152-2715, 2152-2723","10.1089/cyber.2017.29073.bkw","http://www.liebertpub.com/doi/10.1089/cyber.2017.29073.bkw","","2017-05","2020-06-05 08:03:27","2020-06-05 08:03:27","2020-06-05 08:03:27","277-277","","5","20","","Cyberpsychology, Behavior, and Social Networking","","","","","","","","en","","","","","DOI.org (Crossref)","","","","","","","","","","","","","","","","","","","","","","","","","","","","","","","","","","","","","","","","","","","","","","","","","","","","",""
"MXF7CVHS","journalArticle","2018","Lee, Eun-Ju; Cho, Eugene","When Using Facebook to Avoid Isolation Reduces Perceived Social Support","Cyberpsychology, Behavior, and Social Networking","","2152-2715, 2152-2723","10.1089/cyber.2016.0602","http://www.liebertpub.com/doi/10.1089/cyber.2016.0602","","2018-01","2020-06-05 08:03:29","2020-06-05 08:03:29","2020-06-05 08:03:29","32-39","","1","21","","Cyberpsychology, Behavior, and Social Networking","","","","","","","","en","","","","","DOI.org (Crossref)","","","","/Users/dougaparry/Zotero/storage/AAFVZ9N5/Lee_Cho_2018_When Using Facebook to Avoid Isolation Reduces Perceived Social Support.pdf","","","","","","","","","","","","","","","","","","","","","","","","","","","","","","","","","","","","","","","","","","","","","","","","",""
"FUP29HUJ","journalArticle","2016","Lim, Sohye; Shim, Hongjin","Who Multitasks on Smartphones? Smartphone Multitaskers' Motivations and Personality Traits","Cyberpsychology, Behavior, and Social Networking","","2152-2715, 2152-2723","10.1089/cyber.2015.0225","http://www.liebertpub.com/doi/10.1089/cyber.2015.0225","","2016-03","2020-06-05 08:03:33","2020-06-05 08:03:33","2020-06-05 08:03:33","223-227","","3","19","","Cyberpsychology, Behavior, and Social Networking","Who Multitasks on Smartphones?","","","","","","","en","","","","","DOI.org (Crossref)","","","","","","","","","","","","","","","","","","","","","","","","","","","","","","","","","","","","","","","","","","","","","","","","","","","","",""
"YQFRG9X2","journalArticle","2019","Shen, Liang; Wang, Lili; Zhang, Xuan","Why and When Consumers Indulge in Smartphones: The Mental Association Between Smartphones and Fun","Cyberpsychology, Behavior, and Social Networking","","2152-2715, 2152-2723","10.1089/cyber.2018.0646","https://www.liebertpub.com/doi/10.1089/cyber.2018.0646","","2019-06-01","2020-06-05 08:03:36","2020-06-05 08:03:36","2020-06-05 08:03:36","381-387","","6","22","","Cyberpsychology, Behavior, and Social Networking","Why and When Consumers Indulge in Smartphones","","","","","","","en","","","","","DOI.org (Crossref)","","","","","","","","","","","","","","","","","","","","","","","","","","","","","","","","","","","","","","","","","","","","","","","","","","","","",""
"A2XTLRPG","journalArticle","2016","Wiederhold, Brenda K.","Why Do People Still Text While Driving?","Cyberpsychology, Behavior, and Social Networking","","2152-2715, 2152-2723","10.1089/cyber.2016.29046.bkw","http://www.liebertpub.com/doi/10.1089/cyber.2016.29046.bkw","","2016-08","2020-06-05 08:03:38","2020-06-05 08:03:38","2020-06-05 08:03:38","473-474","","8","19","","Cyberpsychology, Behavior, and Social Networking","","","","","","","","en","","","","","DOI.org (Crossref)","","","","","","","","","","","","","","","","","","","","","","","","","","","","","","","","","","","","","","","","","","","","","","","","","","","","",""
"QJVSWUYH","journalArticle","2019","Wiederhold, Brenda K.","Win or Lose: Do Video Games Breed Success in the Modern World?","Cyberpsychology, Behavior, and Social Networking","","2152-2715, 2152-2723","10.1089/cyber.2019.29156.bkw","https://www.liebertpub.com/doi/10.1089/cyber.2019.29156.bkw","","2019-07","2020-06-05 08:03:39","2020-06-05 08:03:39","2020-06-05 08:03:39","431-432","","7","22","","Cyberpsychology, Behavior, and Social Networking","Win or Lose","","","","","","","en","","","","","DOI.org (Crossref)","","","","","","","","","","","","","","","","","","","","","","","","","","","","","","","","","","","","","","","","","","","","","","","","","","","","",""
"A4JP93UM","journalArticle","2014","Chen, Sung-Wei; Gau, Susan Shur-Fen; Pikhart, Hynek; Peasey, Anne; Chen, Shih-Tse; Tsai, Ming-Chen","Work Stress and Subsequent Risk of Internet Addiction Among Information Technology Engineers in Taiwan","Cyberpsychology, Behavior, and Social Networking","","2152-2715, 2152-2723","10.1089/cyber.2013.0686","http://www.liebertpub.com/doi/10.1089/cyber.2013.0686","","2014-08","2020-06-05 08:03:42","2020-06-05 08:03:42","2020-06-05 08:03:42","542-550","","8","17","","Cyberpsychology, Behavior, and Social Networking","","","","","","","","en","","","","","DOI.org (Crossref)","","","","","","","","","","","","","","","","","","","","","","","","","","","","","","","","","","","","","","","","","","","","","","","","","","","","",""
"XT8HWZNP","journalArticle","2020","Anwar, Aizza; Kee, Daisy Mui Hung; Ahmed, Alia","Workplace Cyberbullying and Interpersonal Deviance: Understanding the Mediating Effect of Silence and Emotional Exhaustion","Cyberpsychology, Behavior, and Social Networking","","2152-2715, 2152-2723","10.1089/cyber.2019.0407","https://www.liebertpub.com/doi/10.1089/cyber.2019.0407","","2020-05-01","2020-06-05 08:03:44","2020-06-05 08:03:44","2020-06-05 08:03:44","290-296","","5","23","","Cyberpsychology, Behavior, and Social Networking","Workplace Cyberbullying and Interpersonal Deviance","","","","","","","en","","","","","DOI.org (Crossref)","","","","","","","","","","","","","","","","","","","","","","","","","","","","","","","","","","","","","","","","","","","","","","","","","","","","",""
"RZDURRCT","journalArticle","2016","Jones, Jacquelynn R.; Colditz, Jason B.; Shensa, Ariel; Sidani, Jaime E.; Lin, Liu Yi; Terry, Martha Ann; Primack, Brian A.","Associations Between Internet-Based Professional Social Networking and Emotional Distress","Cyberpsychology, Behavior, and Social Networking","","2152-2715, 2152-2723","10.1089/cyber.2016.0134","http://www.liebertpub.com/doi/10.1089/cyber.2016.0134","","2016-10","2020-06-05 12:09:34","2020-06-05 12:09:34","2020-06-05 12:09:34","601-608","","10","19","","Cyberpsychology, Behavior, and Social Networking","","","","","","","","en","","","","","DOI.org (Crossref)","","","","/Users/dougaparry/Zotero/storage/XBJN86BL/Jones et al. - 2016 - Associations Between Internet-Based Professional S.pdf","","","","","","","","","","","","","","","","","","","","","","","","","","","","","","","","","","","","","","","","","","","","","","","","",""
"B4I32RNU","journalArticle","2017","Holfeld, Brett; Sukhawathanakul, Paweena","Associations Between Internet Attachment, Cyber Victimization, and Internalizing Symptoms Among Adolescents","Cyberpsychology, Behavior, and Social Networking","","2152-2715, 2152-2723","10.1089/cyber.2016.0194","http://www.liebertpub.com/doi/10.1089/cyber.2016.0194","","2017-02","2020-06-05 12:09:31","2020-06-05 12:09:31","2020-06-05 12:09:31","91-96","","2","20","","Cyberpsychology, Behavior, and Social Networking","","","","","","","","en","","","","","DOI.org (Crossref)","","","","","","","","","","","","","","","","","","","","","","","","","","","","","","","","","","","","","","","","","","","","","","","","","","","","",""
"ZASD8TKM","journalArticle","2013","Shin, Dong-Hee; Ahn, Dohyun","Associations Between Game Use and Cognitive Empathy: A Cross-Generational Study","Cyberpsychology, Behavior, and Social Networking","","2152-2715, 2152-2723","10.1089/cyber.2012.0639","http://www.liebertpub.com/doi/10.1089/cyber.2012.0639","","2013-08","2020-06-05 12:09:30","2020-06-05 12:09:30","2020-06-05 12:09:30","599-603","","8","16","","Cyberpsychology, Behavior, and Social Networking","Associations Between Game Use and Cognitive Empathy","","","","","","","en","","","","","DOI.org (Crossref)","","","","","","","","","","","","","","","","","","","","","","","","","","","","","","","","","","","","","","","","","","","","","","","","","","","","",""
"3KJSNKA3","journalArticle","2014","Lobel, Adam; Granic, Isabela; Stone, Lisanne L.; Engels, Rutger C.M.E.","Associations Between Children's Video Game Playing and Psychosocial Health: Information from Both Parent and Child Reports","Cyberpsychology, Behavior, and Social Networking","","2152-2715, 2152-2723","10.1089/cyber.2014.0128","http://www.liebertpub.com/doi/10.1089/cyber.2014.0128","","2014-10","2020-06-05 12:09:28","2020-06-05 12:09:28","2020-06-05 12:09:28","639-643","","10","17","","Cyberpsychology, Behavior, and Social Networking","Associations Between Children's Video Game Playing and Psychosocial Health","","","","","","","en","","","","","DOI.org (Crossref)","","","","","","","","","","","","","","","","","","","","","","","","","","","","","","","","","","","","","","","","","","","","","","","","","","","","",""
"ZX7CYAF7","journalArticle","2016","Morioka, Hisayoshi; Itani, Osamu; Osaki, Yoneatsu; Higuchi, Susumu; Jike, Maki; Kaneita, Yoshitaka; Kanda, Hideyuki; Nakagome, Sachi; Ohida, Takashi","Association Between Smoking and Problematic Internet Use Among Japanese Adolescents: Large-Scale Nationwide Epidemiological Study","Cyberpsychology, Behavior, and Social Networking","","2152-2715, 2152-2723","10.1089/cyber.2016.0182","http://www.liebertpub.com/doi/10.1089/cyber.2016.0182","","2016-09","2020-06-05 12:09:26","2020-06-05 12:09:26","2020-06-05 12:09:26","557-561","","9","19","","Cyberpsychology, Behavior, and Social Networking","Association Between Smoking and Problematic Internet Use Among Japanese Adolescents","","","","","","","en","","","","","DOI.org (Crossref)","","","","","","","","","","","","","","","","","","","","","","","","","","","","","","","","","","","","","","","","","","","","","","","","","","","","",""
"WBGKKLJD","journalArticle","2012","Mazhari, Shahrzad","Association Between Problematic Internet Use and Impulse Control Disorders Among Iranian University Students","Cyberpsychology, Behavior, and Social Networking","","2152-2715, 2152-2723","10.1089/cyber.2011.0548","http://www.liebertpub.com/doi/10.1089/cyber.2011.0548","","2012-05","2020-06-05 12:09:24","2020-06-05 12:09:24","2020-06-05 12:09:24","270-273","","5","15","","Cyberpsychology, Behavior, and Social Networking","","","","","","","","en","","","","","DOI.org (Crossref)","","","","","","","","","","","","","","","","","","","","","","","","","","","","","","","","","","","","","","","","","","","","","","","","","","","","",""
"QG7EPV5G","journalArticle","2015","Harkness, Emily L.; Mullan, Barbara; Blaszczynski, Alex","Association Between Pornography Use and Sexual Risk Behaviors in Adult Consumers: A Systematic Review","Cyberpsychology, Behavior, and Social Networking","","2152-2715, 2152-2723","10.1089/cyber.2014.0343","http://www.liebertpub.com/doi/10.1089/cyber.2014.0343","","2015-02","2020-06-05 12:09:22","2020-06-05 12:09:22","2020-06-05 12:09:22","59-71","","2","18","","Cyberpsychology, Behavior, and Social Networking","Association Between Pornography Use and Sexual Risk Behaviors in Adult Consumers","","","","","","","en","","","","","DOI.org (Crossref)","","","","","","","","","","","","","","","","","","","","","","","","","","","","","","","","","","","","","","","","","","","","","","","","","","","","",""
"PMCXCCYS","journalArticle","2019","Sakakihara, Aya; Haga, Chiyori; Osaki, Yoneatsu","Association Between Mothers' Problematic Internet Use and the Thinness of Their Children","Cyberpsychology, Behavior, and Social Networking","","2152-2715, 2152-2723","10.1089/cyber.2018.0685","https://www.liebertpub.com/doi/10.1089/cyber.2018.0685","","2019-09-01","2020-06-05 12:09:18","2020-06-05 12:09:18","2020-06-05 12:09:18","578-587","","9","22","","Cyberpsychology, Behavior, and Social Networking","","","","","","","","en","","","","","DOI.org (Crossref)","","","","/Users/dougaparry/Zotero/storage/JSBVAV3T/Sakakihara et al. - 2019 - Association Between Mothers' Problematic Internet .pdf","","","","","","","","","","","","","","","","","","","","","","","","","","","","","","","","","","","","","","","","","","","","","","","","",""
"NZVWSCIV","journalArticle","2019","Mantzouranis, Gregory; Baudat, Sophie; Zimmermann, Grégoire","Assessing Online and Offline Adolescent Social Skills: Development and Validation of the Real and Electronic Communication Skills Questionnaire","Cyberpsychology, Behavior, and Social Networking","","2152-2715, 2152-2723","10.1089/cyber.2018.0655","https://www.liebertpub.com/doi/10.1089/cyber.2018.0655","","2019-06","2020-06-05 12:09:13","2020-06-05 12:09:13","2020-06-05 12:09:13","404-411","","6","22","","Cyberpsychology, Behavior, and Social Networking","Assessing Online and Offline Adolescent Social Skills","","","","","","","en","","","","","DOI.org (Crossref)","","","","/Users/dougaparry/Zotero/storage/ZFIB6SN2/Mantzouranis et al. - 2019 - Assessing Online and Offline Adolescent Social Ski.pdf","","","","","","","","","","","","","","","","","","","","","","","","","","","","","","","","","","","","","","","","","","","","","","","","",""
"R7GBWGHB","journalArticle","2020","Schaffer, Daniel R.; Debb, Scott M.","Assessing Instagram Use Across Cultures: A Confirmatory Factor Analysis","Cyberpsychology, Behavior, and Social Networking","","2152-2715, 2152-2723","10.1089/cyber.2019.0247","https://www.liebertpub.com/doi/10.1089/cyber.2019.0247","","2020-02-01","2020-06-05 12:09:09","2020-06-05 12:09:09","2020-06-05 12:09:09","100-106","","2","23","","Cyberpsychology, Behavior, and Social Networking","Assessing Instagram Use Across Cultures","","","","","","","en","","","","","DOI.org (Crossref)","","","","","","","","","","","","","","","","","","","","","","","","","","","","","","","","","","","","","","","","","","","","","","","","","","","","",""
"RW5V49PU","journalArticle","2012","Wiederhold, Brenda K.","As Parents Invade Facebook, Teens Tweet More","Cyberpsychology, Behavior, and Social Networking","","2152-2715, 2152-2723","10.1089/cyber.2012.1554","http://www.liebertpub.com/doi/10.1089/cyber.2012.1554","","2012-08","2020-06-05 12:09:07","2020-06-05 12:09:07","2020-06-05 12:09:07","385-385","","8","15","","Cyberpsychology, Behavior, and Social Networking","","","","","","","","en","","","","","DOI.org (Crossref)","","","","","","","","","","","","","","","","","","","","","","","","","","","","","","","","","","","","","","","","","","","","","","","","","","","","",""
"HWRGGZ8B","journalArticle","2012","Kairouz, Sylvia; Paradis, Catherine; Nadeau, Louise","Are Online Gamblers More At Risk Than Offline Gamblers?","Cyberpsychology, Behavior, and Social Networking","","2152-2715, 2152-2723","10.1089/cyber.2011.0260","http://www.liebertpub.com/doi/10.1089/cyber.2011.0260","","2012-03","2020-06-05 12:09:03","2020-06-05 12:09:03","2020-06-05 12:09:02","175-180","","3","15","","Cyberpsychology, Behavior, and Social Networking","","","","","","","","en","","","","","DOI.org (Crossref)","","","","/Users/dougaparry/Zotero/storage/4HVJ2UMI/Kairouz et al. - 2012 - Are Online Gamblers More At Risk Than Offline Gamb.pdf","","","","","","","","","","","","","","","","","","","","","","","","","","","","","","","","","","","","","","","","","","","","","","","","",""
"943UZ959","journalArticle","2012","Kneer, Julia; Glock, Sabine; Beskes, Sara; Bente, Gary","Are Digital Games Perceived as Fun or Danger? Supporting and Suppressing Different Game-Related Concepts","Cyberpsychology, Behavior, and Social Networking","","2152-2715, 2152-2723","10.1089/cyber.2012.0171","http://www.liebertpub.com/doi/10.1089/cyber.2012.0171","","2012-11","2020-06-05 12:09:01","2020-06-05 12:09:01","2020-06-05 12:09:01","604-609","","11","15","","Cyberpsychology, Behavior, and Social Networking","Are Digital Games Perceived as Fun or Danger?","","","","","","","en","","","","","DOI.org (Crossref)","","","","","","","","","","","","","","","","","","","","","","","","","","","","","","","","","","","","","","","","","","","","","","","","","","","","",""
"NQEXYP78","journalArticle","2019","Cole, David A.; Nick, Elizabeth A.; Varga, Gergely; Smith, Darcy; Zelkowitz, Rachel L.; Ford, Mallory A.; Lédeczi, Ákos","Are Aspects of Twitter Use Associated with Reduced Depressive Symptoms? The Moderating Role of In-Person Social Support","Cyberpsychology, Behavior, and Social Networking","","2152-2715, 2152-2723","10.1089/cyber.2019.0035","https://www.liebertpub.com/doi/10.1089/cyber.2019.0035","","2019-11-01","2020-06-05 12:08:59","2020-06-05 12:08:59","2020-06-05 12:08:59","692-699","","11","22","","Cyberpsychology, Behavior, and Social Networking","Are Aspects of Twitter Use Associated with Reduced Depressive Symptoms?","","","","","","","en","","","","","DOI.org (Crossref)","","","","","","","","","","","","","","","","","","","","","","","","","","","","","","","","","","","","","","","","","","","","","","","","","","","","",""
