"VXFUFBWH","journalArticle","2009","Park, Namsu; Kee, Kerk F.; Valenzuela, Sebastián","Being Immersed in Social Networking Environment: Facebook Groups, Uses and Gratifications, and Social Outcomes","CyberPsychology & Behavior","","1094-9313, 1557-8364","10.1089/cpb.2009.0003","http://www.liebertpub.com/doi/10.1089/cpb.2009.0003","","2009-12","2020-06-05 12:09:50","2020-06-05 12:09:50","2020-06-05 12:09:50","729-733","","6","12","","CyberPsychology & Behavior","Being Immersed in Social Networking Environment","","","","","","","en","","","","","DOI.org (Crossref)","","","","/Users/dougaparry/Zotero/storage/HPGGUTK8/Park et al. - 2009 - Being Immersed in Social Networking Environment F.pdf","","","","","","","","","","","","","","","","","","","","","","","","","","","","","","","","","","","","","","","","","","","","","","","","",""
"BLIVSNGK","journalArticle","2012","Lee, Sook-Jung; Chae, Young-Gil","Balancing Participation and Risks in Children's Internet Use: The Role of Internet Literacy and Parental Mediation","Cyberpsychology, Behavior, and Social Networking","","2152-2715, 2152-2723","10.1089/cyber.2011.0552","http://www.liebertpub.com/doi/10.1089/cyber.2011.0552","","2012-05","2020-06-05 12:09:47","2020-06-05 12:09:47","2020-06-05 12:09:47","257-262","","5","15","","Cyberpsychology, Behavior, and Social Networking","Balancing Participation and Risks in Children's Internet Use","","","","","","","en","","","","","DOI.org (Crossref)","","","","","","","","","","","","","","","","","","","","","","","","","","","","","","","","","","","","","","","","","","","","","","","","","","","","",""
"R9E5X7T2","journalArticle","2015","Kreutzer, Christine P.; Bowers, Clint A.","Attitudes Toward a Game-Based Approach to Mental Health","Cyberpsychology, Behavior, and Social Networking","","2152-2715, 2152-2723","10.1089/cyber.2014.0382","http://www.liebertpub.com/doi/10.1089/cyber.2014.0382","","2015-01","2020-06-05 12:09:46","2020-06-05 12:09:46","2020-06-05 12:09:46","20-24","","1","18","","Cyberpsychology, Behavior, and Social Networking","","","","","","","","en","","","","","DOI.org (Crossref)","","","","","","","","","","","","","","","","","","","","","","","","","","","","","","","","","","","","","","","","","","","","","","","","","","","","",""
"2U95VNF6","journalArticle","2018","Worsley, Joanne D.; Mansfield, Rosie; Corcoran, Rhiannon","Attachment Anxiety and Problematic Social Media Use: The Mediating Role of Well-Being","Cyberpsychology, Behavior, and Social Networking","","2152-2715, 2152-2723","10.1089/cyber.2017.0555","https://www.liebertpub.com/doi/10.1089/cyber.2017.0555","","2018-09","2020-06-05 12:09:42","2020-06-05 12:09:42","2020-06-05 12:09:42","563-568","","9","21","","Cyberpsychology, Behavior, and Social Networking","Attachment Anxiety and Problematic Social Media Use","","","","","","","en","","","","","DOI.org (Crossref)","","","","","","","","","","","","","","","","","","","","","","","","","","","","","","","","","","","","","","","","","","","","","","","","","","","","",""
"4ERS8GQB","journalArticle","2017","Wartberg, Lutz; Kriston, Levente; Kammerl, Rudolf","Associations of Social Support, Friends Only Known Through the Internet, and Health-Related Quality of Life with Internet Gaming Disorder in Adolescence","Cyberpsychology, Behavior, and Social Networking","","2152-2715, 2152-2723","10.1089/cyber.2016.0535","http://www.liebertpub.com/doi/10.1089/cyber.2016.0535","","2017-07","2020-06-05 12:09:40","2020-06-05 12:09:40","2020-06-05 12:09:40","436-441","","7","20","","Cyberpsychology, Behavior, and Social Networking","","","","","","","","en","","","","","DOI.org (Crossref)","","","","","","","","","","","","","","","","","","","","","","","","","","","","","","","","","","","","","","","","","","","","","","","","","","","","",""
"DHABL9TC","journalArticle","2017","Twomey, Conal; O'Reilly, Gary","Associations of Self-Presentation on Facebook with Mental Health and Personality Variables: A Systematic Review","Cyberpsychology, Behavior, and Social Networking","","2152-2715, 2152-2723","10.1089/cyber.2017.0247","http://www.liebertpub.com/doi/10.1089/cyber.2017.0247","","2017-10","2020-06-05 12:09:38","2020-06-05 12:09:38","2020-06-05 12:09:38","587-595","","10","20","","Cyberpsychology, Behavior, and Social Networking","Associations of Self-Presentation on Facebook with Mental Health and Personality Variables","","","","","","","en","","","","","DOI.org (Crossref)","","","","","","","","","","","","","","","","","","","","","","","","","","","","","","","","","","","","","","","","","","","","","","","","","","","","",""
"GX2ACU6U","journalArticle","2007","Stevens, Sarah B.; Morris, Tracy L.","College Dating and Social Anxiety: Using the Internet as a Means of Connecting to Others","CyberPsychology & Behavior","","1094-9313, 1557-8364","10.1089/cpb.2007.9970","http://www.liebertpub.com/doi/10.1089/cpb.2007.9970","","2007-10","2020-06-05 12:10:52","2020-06-05 12:10:52","2020-06-05 12:10:52","680-688","","5","10","","CyberPsychology & Behavior","College Dating and Social Anxiety","","","","","","","en","","","","","DOI.org (Crossref)","","","","/Users/dougaparry/Zotero/storage/INU3UV97/Stevens and Morris - 2007 - College Dating and Social Anxiety Using the Inter.pdf","","","","","","","","","","","","","","","","","","","","","","","","","","","","","","","","","","","","","","","","","","","","","","","","",""
"WSPIJGEM","journalArticle","2007","Choi, Boreum; Lee, Inseong; Choi, Dongseong; Kim, Jinwoo","Collaborate and Share: An Experimental Study of the Effects of Task and Reward Interdependencies in Online Games","CyberPsychology & Behavior","","1094-9313, 1557-8364","10.1089/cpb.2007.9985","http://www.liebertpub.com/doi/10.1089/cpb.2007.9985","","2007-08","2020-06-05 12:10:49","2020-06-05 12:10:49","2020-06-05 12:10:49","591-595","","4","10","","CyberPsychology & Behavior","Collaborate and Share","","","","","","","en","","","","","DOI.org (Crossref)","","","","/Users/dougaparry/Zotero/storage/MCWA993H/Choi et al. - 2007 - Collaborate and Share An Experimental Study of th.pdf","","","","","","","","","","","","","","","","","","","","","","","","","","","","","","","","","","","","","","","","","","","","","","","","",""
"39UBXRKN","journalArticle","2013","Barrault, Servane; Varescon, Isabelle","Cognitive Distortions, Anxiety, and Depression Among Regular and Pathological Gambling Online Poker Players","Cyberpsychology, Behavior, and Social Networking","","2152-2715, 2152-2723","10.1089/cyber.2012.0150","http://www.liebertpub.com/doi/10.1089/cyber.2012.0150","","2013-03","2020-06-05 12:10:47","2020-06-05 12:10:47","2020-06-05 12:10:47","183-188","","3","16","","Cyberpsychology, Behavior, and Social Networking","","","","","","","","en","","","","","DOI.org (Crossref)","","","","","","","","","","","","","","","","","","","","","","","","","","","","","","","","","","","","","","","","","","","","","","","","","","","","",""
"RARBFH9K","journalArticle","2007","Young, Kimberly S.","Cognitive Behavior Therapy with Internet Addicts: Treatment Outcomes and Implications","CyberPsychology & Behavior","","1094-9313, 1557-8364","10.1089/cpb.2007.9971","http://www.liebertpub.com/doi/10.1089/cpb.2007.9971","","2007-10","2020-06-05 12:10:44","2020-06-05 12:10:44","2020-06-05 12:10:44","671-679","","5","10","","CyberPsychology & Behavior","Cognitive Behavior Therapy with Internet Addicts","","","","","","","en","","","","","DOI.org (Crossref)","","","","/Users/dougaparry/Zotero/storage/NWWUJRUV/Young - 2007 - Cognitive Behavior Therapy with Internet Addicts .pdf","","","","","","","","","","","","","","","","","","","","","","","","","","","","","","","","","","","","","","","","","","","","","","","","",""
"T8SC4K5X","journalArticle","2011","Alarcón-del-Amo, María-del-Carmen; Lorenzo-Romero, Carlota; Gómez-Borja, Miguel-Ángel","Classifying and Profiling Social Networking Site Users: A Latent Segmentation Approach","Cyberpsychology, Behavior, and Social Networking","","2152-2715, 2152-2723","10.1089/cyber.2010.0346","http://www.liebertpub.com/doi/10.1089/cyber.2010.0346","","2011-09","2020-06-05 12:10:43","2020-06-05 12:10:43","2020-06-05 12:10:43","547-553","","9","14","","Cyberpsychology, Behavior, and Social Networking","Classifying and Profiling Social Networking Site Users","","","","","","","en","","","","","DOI.org (Crossref)","","","","","","","","","","","","","","","","","","","","","","","","","","","","","","","","","","","","","","","","","","","","","","","","","","","","",""
"IJ55ZHET","journalArticle","2007","Mitchell, Kimberly J.; Finkelhor, David; Becker-Blease, Kathryn A.","Classification of Adults with Problematic Internet Experiences: Linking Internet and Conventional Problems from a Clinical Perspective","CyberPsychology & Behavior","","1094-9313, 1557-8364","10.1089/cpb.2006.9941","http://www.liebertpub.com/doi/10.1089/cpb.2006.9941","","2007-06","2020-06-05 12:10:36","2020-06-05 12:10:36","2020-06-05 12:10:36","381-392","","3","10","","CyberPsychology & Behavior","Classification of Adults with Problematic Internet Experiences","","","","","","","en","","","","","DOI.org (Crossref)","","","","/Users/dougaparry/Zotero/storage/NNX95TAB/Mitchell et al. - 2007 - Classification of Adults with Problematic Internet.pdf","","","","","","","","","","","","","","","","","","","","","","","","","","","","","","","","","","","","","","","","","","","","","","","","",""
"W2KS3DSK","journalArticle","2007","Huang, Zheng; Wang, Mo; Qian, Mingyi; Zhong, Jie; Tao, Ran","Chinese Internet Addiction Inventory: Developing a Measure of Problematic Internet Use for Chinese College Students","CyberPsychology & Behavior","","1094-9313, 1557-8364","10.1089/cpb.2007.9950","http://www.liebertpub.com/doi/10.1089/cpb.2007.9950","","2007-12","2020-06-05 12:10:34","2020-06-05 12:10:34","2020-06-05 12:10:34","805-812","","6","10","","CyberPsychology & Behavior","Chinese Internet Addiction Inventory","","","","","","","en","","","","","DOI.org (Crossref)","","","","","","","","","","","","","","","","","","","","","","","","","","","","","","","","","","","","","","","","","","","","","","","","","","","","",""
"8P6FURH5","journalArticle","2007","Lee, Sook-Jung; Chae, Young-Gil","Children's Internet Use in a Family Context: Influence on Family Relationships and Parental Mediation","CyberPsychology & Behavior","","1094-9313, 1557-8364","10.1089/cpb.2007.9975","http://www.liebertpub.com/doi/10.1089/cpb.2007.9975","","2007-10","2020-06-05 12:10:33","2020-06-05 12:10:33","2020-06-05 12:10:33","640-644","","5","10","","CyberPsychology & Behavior","Children's Internet Use in a Family Context","","","","","","","en","","","","","DOI.org (Crossref)","","","","","","","","","","","","","","","","","","","","","","","","","","","","","","","","","","","","","","","","","","","","","","","","","","","","",""
"2UDXCPEA","journalArticle","2009","Skoric, Marko M.; Teo, Linda Lay Ching; Neo, Rachel Lijie","Children and Video Games: Addiction, Engagement, and Scholastic Achievement","CyberPsychology & Behavior","","1094-9313, 1557-8364","10.1089/cpb.2009.0079","http://www.liebertpub.com/doi/10.1089/cpb.2009.0079","","2009-10","2020-06-05 12:10:28","2020-06-05 12:10:28","2020-06-05 12:10:28","567-572","","5","12","","CyberPsychology & Behavior","Children and Video Games","","","","","","","en","","","","","DOI.org (Crossref)","","","","/Users/dougaparry/Zotero/storage/884S272Z/Skoric et al. - 2009 - Children and Video Games Addiction, Engagement, a.pdf","","","","","","","","","","","","","","","","","","","","","","","","","","","","","","","","","","","","","","","","","","","","","","","","",""
"ERGS2CXD","journalArticle","2012","Yates, Tuppett M.; Gregor, Margo A.; Haviland, Mark G.","Child Maltreatment, Alexithymia, and Problematic Internet Use in Young Adulthood","Cyberpsychology, Behavior, and Social Networking","","2152-2715, 2152-2723","10.1089/cyber.2011.0427","http://www.liebertpub.com/doi/10.1089/cyber.2011.0427","","2012-04","2020-06-05 12:10:27","2020-06-05 12:10:27","2020-06-05 12:10:27","219-225","","4","15","","Cyberpsychology, Behavior, and Social Networking","","","","","","","","en","","","","","DOI.org (Crossref)","","","","","","","","","","","","","","","","","","","","","","","","","","","","","","","","","","","","","","","","","","","","","","","","","","","","",""
"L3J5QBT5","journalArticle","2007","Lee, Moon-Soo; Ko, Young-Hoon; Song, Hyoung-Seok; Kwon, Ku-Hyung; Lee, Hyeon-Soo; Nam, Min; Jung, In-Kwa","Characteristics of Internet Use in Relation to Game Genre in Korean Adolescents","CyberPsychology & Behavior","","1094-9313, 1557-8364","10.1089/cpb.2006.9958","http://www.liebertpub.com/doi/10.1089/cpb.2006.9958","","2007-04","2020-06-05 12:10:25","2020-06-05 12:10:25","2020-06-05 12:10:25","278-285","","2","10","","CyberPsychology & Behavior","","","","","","","","en","","","","","DOI.org (Crossref)","","","","","","","","","","","","","","","","","","","","","","","","","","","","","","","","","","","","","","","","","","","","","","","","","","","","",""
"W5PWH38G","journalArticle","2011","Koronczai, Beatrix; Urbán, Róbert; Kökönyei, Gyöngyi; Paksi, Borbála; Papp, Krisztina; Kun, Bernadette; Arnold, Petra; Kállai, János; Demetrovics, Zsolt","Confirmation of the Three-Factor Model of Problematic Internet Use on Off-Line Adolescent and Adult Samples","Cyberpsychology, Behavior, and Social Networking","","2152-2715, 2152-2723","10.1089/cyber.2010.0345","http://www.liebertpub.com/doi/10.1089/cyber.2010.0345","","2011-11","2020-06-05 12:11:45","2020-06-05 12:11:45","2020-06-05 12:11:45","657-664","","11","14","","Cyberpsychology, Behavior, and Social Networking","","","","","","","","en","","","","","DOI.org (Crossref)","","","","/Users/dougaparry/Zotero/storage/B3TY6VJC/Koronczai et al. - 2011 - Confirmation of the Three-Factor Model of Problema.pdf","","","","","","","","","","","","","","","","","","","","","","","","","","","","","","","","","","","","","","","","","","","","","","","","",""
"7JPZ3NT2","journalArticle","2018","Silva, Patricia; Delerue Matos, Alice; Martinez-Pecino, Roberto","Confidant Network and Quality of Life of Individuals Aged 50+: The Positive Role of Internet Use","Cyberpsychology, Behavior, and Social Networking","","2152-2715, 2152-2723","10.1089/cyber.2018.0170","https://www.liebertpub.com/doi/10.1089/cyber.2018.0170","","2018-11","2020-06-05 12:11:44","2020-06-05 12:11:44","2020-06-05 12:11:44","694-702","","11","21","","Cyberpsychology, Behavior, and Social Networking","Confidant Network and Quality of Life of Individuals Aged 50+","","","","","","","en","","","","","DOI.org (Crossref)","","","","","","","","","","","","","","","","","","","","","","","","","","","","","","","","","","","","","","","","","","","","","","","","","","","","",""
"CMK5SCSN","journalArticle","2018","Chang, Fong-Ching; Chiu, Chiung-Hui; Chen, Ping-Hung; Miao, Nae-Fang; Chiang, Jeng-Tung; Chuang, Hung-Yi","Computer/Mobile Device Screen Time of Children and Their Eye Care Behavior: The Roles of Risk Perception and Parenting","Cyberpsychology, Behavior, and Social Networking","","2152-2715, 2152-2723","10.1089/cyber.2017.0324","http://www.liebertpub.com/doi/10.1089/cyber.2017.0324","","2018-03","2020-06-05 12:11:40","2020-06-05 12:11:40","2020-06-05 12:11:40","179-186","","3","21","","Cyberpsychology, Behavior, and Social Networking","Computer/Mobile Device Screen Time of Children and Their Eye Care Behavior","","","","","","","en","","","","","DOI.org (Crossref)","","","","","","","","","","","","","","","","","","","","","","","","","","","","","","","","","","","","","","","","","","","","","","","","","","","","",""
"X3REZ3A4","journalArticle","2007","Antheunis, Marjolijn L.; Valkenburg, Patti M.; Peter, Jochen","Computer-Mediated Communication and Interpersonal Attraction: An Experimental Test of Two Explanatory Hypotheses","CyberPsychology & Behavior","","1094-9313, 1557-8364","10.1089/cpb.2007.9945","http://www.liebertpub.com/doi/10.1089/cpb.2007.9945","","2007-12","2020-06-05 12:11:39","2020-06-05 12:11:39","2020-06-05 12:11:39","831-836","","6","10","","CyberPsychology & Behavior","Computer-Mediated Communication and Interpersonal Attraction","","","","","","","en","","","","","DOI.org (Crossref)","","","","","","","","","","","","","","","","","","","","","","","","","","","","","","","","","","","","","","","","","","","","","","","","","","","","",""
"6DEG8KNF","journalArticle","2014","De Cock, Rozane; Vangeel, Jolien; Klein, Annabelle; Minotte, Pascal; Rosas, Omar; Meerkerk, Gert-Jan","Compulsive Use of Social Networking Sites in Belgium: Prevalence, Profile, and the Role of Attitude Toward Work and School","Cyberpsychology, Behavior, and Social Networking","","2152-2715, 2152-2723","10.1089/cyber.2013.0029","http://www.liebertpub.com/doi/10.1089/cyber.2013.0029","","2014-03","2020-06-05 12:11:38","2020-06-05 12:11:38","2020-06-05 12:11:38","166-171","","3","17","","Cyberpsychology, Behavior, and Social Networking","Compulsive Use of Social Networking Sites in Belgium","","","","","","","en","","","","","DOI.org (Crossref)","","","","","","","","","","","","","","","","","","","","","","","","","","","","","","","","","","","","","","","","","","","","","","","","","","","","",""
"ALD5MECE","journalArticle","2015","Lee, Junghan; Lee, Seojung; Chun, Ji Won; Cho, Hyun; Kim, Dai-jin; Jung, Young-Chul","Compromised Prefrontal Cognitive Control Over Emotional Interference in Adolescents with Internet Gaming Disorder","Cyberpsychology, Behavior, and Social Networking","","2152-2715, 2152-2723","10.1089/cyber.2015.0231","http://www.liebertpub.com/doi/10.1089/cyber.2015.0231","","2015-11","2020-06-05 12:11:35","2020-06-05 12:11:35","2020-06-05 12:11:35","661-668","","11","18","","Cyberpsychology, Behavior, and Social Networking","","","","","","","","en","","","","","DOI.org (Crossref)","","","","","","","","","","","","","","","","","","","","","","","","","","","","","","","","","","","","","","","","","","","","","","","","","","","","",""
"PIJW7ZZK","journalArticle","2011","Shin, Sang-Eun; Kim, Nam-Seok; Jang, Eun-Young","Comparison of Problematic Internet and Alcohol Use and Attachment Styles Among Industrial Workers in Korea","Cyberpsychology, Behavior, and Social Networking","","2152-2715, 2152-2723","10.1089/cyber.2010.0470","http://www.liebertpub.com/doi/10.1089/cyber.2010.0470","","2011-11","2020-06-05 12:11:33","2020-06-05 12:11:33","2020-06-05 12:11:33","665-672","","11","14","","Cyberpsychology, Behavior, and Social Networking","","","","","","","","en","","","","","DOI.org (Crossref)","","","","","","","","","","","","","","","","","","","","","","","","","","","","","","","","","","","","","","","","","","","","","","","","","","","","",""
"J88PNT5N","journalArticle","2007","Yu, Sen-Chi; Yu, Min-Ning","Comparison of Internet-Based and Paper-Based Questionnaires in Taiwan Using Multisample Invariance Approach","CyberPsychology & Behavior","","1094-9313, 1557-8364","10.1089/cpb.2007.9998","http://www.liebertpub.com/doi/10.1089/cpb.2007.9998","","2007-08","2020-06-05 12:11:30","2020-06-05 12:11:30","2020-06-05 12:11:30","501-507","","4","10","","CyberPsychology & Behavior","","","","","","","","en","","","","","DOI.org (Crossref)","","","","/Users/dougaparry/Zotero/storage/2LC3N97Z/Yu and Yu - 2007 - Comparison of Internet-Based and Paper-Based Quest.pdf","","","","","","","","","","","","","","","","","","","","","","","","","","","","","","","","","","","","","","","","","","","","","","","","",""
"8AZ3BUZ8","journalArticle","2013","Joiner, Richard; Gavin, Jeff; Brosnan, Mark; Cromby, John; Gregory, Helen; Guiller, Jane; Maras, Pam; Moon, Amy","Comparing First and Second Generation Digital Natives' Internet Use, Internet Anxiety, and Internet Identification","Cyberpsychology, Behavior, and Social Networking","","2152-2715, 2152-2723","10.1089/cyber.2012.0526","http://www.liebertpub.com/doi/10.1089/cyber.2012.0526","","2013-07","2020-06-05 12:11:27","2020-06-05 12:11:27","2020-06-05 12:11:27","549-552","","7","16","","Cyberpsychology, Behavior, and Social Networking","","","","","","","","en","","","","","DOI.org (Crossref)","","","","/Users/dougaparry/Zotero/storage/L5TDU9JR/Joiner et al. - 2013 - Comparing First and Second Generation Digital Nati.pdf","","","","","","","","","","","","","","","","","","","","","","","","","","","","","","","","","","","","","","","","","","","","","","","","",""
"4RJ8BM7H","journalArticle","2011","Ong, Chorng-Shyong; Chang, Shu-Chen; Wang, Chih-Chien","Comparative Loneliness of Users Versus Nonusers of Online Chatting","Cyberpsychology, Behavior, and Social Networking","","2152-2715, 2152-2723","10.1089/cyber.2009.0321","http://www.liebertpub.com/doi/10.1089/cyber.2009.0321","","2011-01","2020-06-05 12:11:24","2020-06-05 12:11:24","2020-06-05 12:11:24","35-40","","1-2","14","","Cyberpsychology, Behavior, and Social Networking","","","","","","","","en","","","","","DOI.org (Crossref)","","","","/Users/dougaparry/Zotero/storage/MP6LD9KB/Ong et al. - 2011 - Comparative Loneliness of Users Versus Nonusers of.pdf","","","","","","","","","","","","","","","","","","","","","","","","","","","","","","","","","","","","","","","","","","","","","","","","",""
"DGXWQBTI","journalArticle","2013","Lee, Hong Joo; Choi, Jaewon; Kim, Jong Woo; Park, Sung Joo; Gloor, Peter","Communication, Opponents, and Clan Performance in Online Games: A Social Network Approach","Cyberpsychology, Behavior, and Social Networking","","2152-2715, 2152-2723","10.1089/cyber.2011.0522","http://www.liebertpub.com/doi/10.1089/cyber.2011.0522","","2013-12","2020-06-05 12:11:21","2020-06-05 12:11:21","2020-06-05 12:11:21","878-883","","12","16","","Cyberpsychology, Behavior, and Social Networking","Communication, Opponents, and Clan Performance in Online Games","","","","","","","en","","","","","DOI.org (Crossref)","","","","/Users/dougaparry/Zotero/storage/LVEYWM2I/Lee et al. - 2013 - Communication, Opponents, and Clan Performance in .pdf","","","","","","","","","","","","","","","","","","","","","","","","","","","","","","","","","","","","","","","","","","","","","","","","",""
"ZUQFHH8K","journalArticle","2013","Cho, Jaehee; Park, Dong Jin; Ordonez, Zoa","Communication-Oriented Person–Organization Fit as a Key Factor of Job-Seeking Behaviors: Millennials' Social Media Use and Attitudes Toward Organizational Social Media Policies","Cyberpsychology, Behavior, and Social Networking","","2152-2715, 2152-2723","10.1089/cyber.2012.0528","http://www.liebertpub.com/doi/10.1089/cyber.2012.0528","","2013-11","2020-06-05 12:11:17","2020-06-05 12:11:17","2020-06-05 12:11:17","794-799","","11","16","","Cyberpsychology, Behavior, and Social Networking","Communication-Oriented Person–Organization Fit as a Key Factor of Job-Seeking Behaviors","","","","","","","en","","","","","DOI.org (Crossref)","","","","/Users/dougaparry/Zotero/storage/Q95E34HM/Cho et al. - 2013 - Communication-Oriented Person–Organization Fit as .pdf","","","","","","","","","","","","","","","","","","","","","","","","","","","","","","","","","","","","","","","","","","","","","","","","",""
"WFLRHLR8","journalArticle","2010","Dowling, N. A.; Brown, M.","Commonalities in the Psychological Factors Associated with Problem Gambling and Internet Dependence","Cyberpsychology, Behavior, and Social Networking","","2152-2715, 2152-2723","10.1089/cyber.2009.0317","http://www.liebertpub.com/doi/10.1089/cyber.2009.0317","","2010-08","2020-06-05 12:11:10","2020-06-05 12:11:10","2020-06-05 12:11:10","437-441","","4","13","","Cyberpsychology, Behavior, and Social Networking","","","","","","","","en","","","","","DOI.org (Crossref)","","","","/Users/dougaparry/Zotero/storage/SBWDFGFF/Dowling and Brown - 2010 - Commonalities in the Psychological Factors Associa.pdf","","","","","","","","","","","","","","","","","","","","","","","","","","","","","","","","","","","","","","","","","","","","","","","","",""
"PGNQLJ5J","journalArticle","2011","Gentzler, Amy L.; Oberhauser, Ann M.; Westerman, David; Nadorff, Danielle K.","College Students' Use of Electronic Communication with Parents: Links to Loneliness, Attachment, and Relationship Quality","Cyberpsychology, Behavior, and Social Networking","","2152-2715, 2152-2723","10.1089/cyber.2009.0409","http://www.liebertpub.com/doi/10.1089/cyber.2009.0409","","2011-01","2020-06-05 12:11:07","2020-06-05 12:11:07","2020-06-05 12:11:07","71-74","","1-2","14","","Cyberpsychology, Behavior, and Social Networking","College Students' Use of Electronic Communication with Parents","","","","","","","en","","","","","DOI.org (Crossref)","","","","/Users/dougaparry/Zotero/storage/766C8SX4/Gentzler et al. - 2011 - College Students' Use of Electronic Communication .pdf","","","","","","","","","","","","","","","","","","","","","","","","","","","","","","","","","","","","","","","","","","","","","","","","",""
"9TLL7ZRF","journalArticle","2013","Ramsey, Meagan A.; Gentzler, Amy L.; Morey, Jennifer N.; Oberhauser, Ann M.; Westerman, David","College Students' Use of Communication Technology with Parents: Comparisons Between Two Cohorts in 2009 and 2011","Cyberpsychology, Behavior, and Social Networking","","2152-2715, 2152-2723","10.1089/cyber.2012.0534","http://www.liebertpub.com/doi/10.1089/cyber.2012.0534","","2013-10","2020-06-05 12:11:03","2020-06-05 12:11:03","2020-06-05 12:11:03","747-752","","10","16","","Cyberpsychology, Behavior, and Social Networking","College Students' Use of Communication Technology with Parents","","","","","","","en","","","","","DOI.org (Crossref)","","","","/Users/dougaparry/Zotero/storage/8BZ9MXU5/Ramsey et al. - 2013 - College Students' Use of Communication Technology .pdf","","","","","","","","","","","","","","","","","","","","","","","","","","","","","","","","","","","","","","","","","","","","","","","","",""
