"GEY8IZSZ","journalArticle","2009","Kim, Junghyun; LaRose, Robert; Peng, Wei","Loneliness as the Cause and the Effect of Problematic Internet Use: The Relationship between Internet Use and Psychological Well-Being","CyberPsychology & Behavior","","1094-9313, 1557-8364","10.1089/cpb.2008.0327","http://www.liebertpub.com/doi/10.1089/cpb.2008.0327","","2009-08","2020-06-11 21:55:55","2020-06-11 21:55:55","2020-06-11 21:55:55","451-455","","4","12","","CyberPsychology & Behavior","Loneliness as the Cause and the Effect of Problematic Internet Use","","","","","","","en","","","","","DOI.org (Crossref)","","","","","","","","","","","","","","","","","","","","","","","","","","","","","","","","","","","","","","","","","","","","","","","","","","","","",""
"98DURGKN","journalArticle","2009","Sum, Shima; Mathews, R. Mark; Pourghasem, Mohsen; Hughes, Ian","Internet Use as a Predictor of Sense of Community in Older People","CyberPsychology & Behavior","","1094-9313, 1557-8364","10.1089/cpb.2008.0150","http://www.liebertpub.com/doi/10.1089/cpb.2008.0150","","2009-04","2020-06-11 21:55:53","2020-06-11 21:55:53","2020-06-11 21:55:53","235-239","","2","12","","CyberPsychology & Behavior","","","","","","","","en","","","","","DOI.org (Crossref)","","","","/Users/dougaparry/Zotero/storage/AKVYILJP/Sum et al. - 2009 - Internet Use as a Predictor of Sense of Community .pdf","","","","","","","","","","","","","","","","","","","","","","","","","","","","","","","","","","","","","","","","","","","","","","","","",""
"D9ZF2G5U","journalArticle","2008","Sum, Shima; Mathews, R. Mark; Hughes, Ian; Campbell, Andrew","Internet Use and Loneliness in Older Adults","CyberPsychology & Behavior","","1094-9313, 1557-8364","10.1089/cpb.2007.0010","http://www.liebertpub.com/doi/10.1089/cpb.2007.0010","","2008-04","2020-06-11 21:55:52","2020-06-11 21:55:52","2020-06-11 21:55:52","208-211","","2","11","","CyberPsychology & Behavior","","","","","","","","en","","","","","DOI.org (Crossref)","","","","/Users/dougaparry/Zotero/storage/7WA3VHQ6/Sum et al. - 2008 - Internet Use and Loneliness in Older Adults.pdf","","","","","","","","","","","","","","","","","","","","","","","","","","","","","","","","","","","","","","","","","","","","","","","","",""
"RWG2CMY9","journalArticle","2007","Özcan, Neslihan Keser; Buzlu, Sevim","Internet Use and Its Relation with the Psychosocial Situation for a Sample of University Students","CyberPsychology & Behavior","","1094-9313, 1557-8364","10.1089/cpb.2007.9953","http://www.liebertpub.com/doi/10.1089/cpb.2007.9953","","2007-12","2020-06-11 21:55:51","2020-06-11 21:55:51","2020-06-11 21:55:51","767-772","","6","10","","CyberPsychology & Behavior","","","","","","","","en","","","","","DOI.org (Crossref)","","","","","","","","","","","","","","","","","","","","","","","","","","","","","","","","","","","","","","","","","","","","","","","","","","","","",""
"A7VX5APG","journalArticle","2008","Tahiroglu, Aysegul Yolga; Celik, Gonca G.; Uzel, Mehtap; Ozcan, Neslihan; Avci, Ayse","Internet Use Among Turkish Adolescents","CyberPsychology & Behavior","","1094-9313, 1557-8364","10.1089/cpb.2007.0165","http://www.liebertpub.com/doi/10.1089/cpb.2007.0165","","2008-10","2020-06-11 21:55:50","2020-06-11 21:55:50","2020-06-11 21:55:50","537-543","","5","11","","CyberPsychology & Behavior","","","","","","","","en","","","","","DOI.org (Crossref)","","","","","","","","","","","","","","","","","","","","","","","","","","","","","","","","","","","","","","","","","","","","","","","","","","","","",""
"3LJSEL3J","journalArticle","2007","Hong, Yan; Li, Xiaoming; Mao, Rong; Stanton, Bonita","Internet Use Among Chinese College Students: Implications for Sex Education and HIV Prevention","CyberPsychology & Behavior","","1094-9313, 1557-8364","10.1089/cpb.2006.9973","http://www.liebertpub.com/doi/10.1089/cpb.2006.9973","","2007-04","2020-06-11 21:55:48","2020-06-11 21:55:48","2020-06-11 21:55:48","161-169","","2","10","","CyberPsychology & Behavior","Internet Use Among Chinese College Students","","","","","","","en","","","","","DOI.org (Crossref)","","","","/Users/dougaparry/Zotero/storage/56UNH6YC/Hong et al. - 2007 - Internet Use Among Chinese College Students Impli.pdf","","","","","","","","","","","","","","","","","","","","","","","","","","","","","","","","","","","","","","","","","","","","","","","","",""
"DH4P4IWM","journalArticle","2008","Leung, Louis","Internet Embeddedness: Links with Online Health Information Seeking, Expectancy Value/Quality of Health Information Websites, and Internet Usage Patterns","CyberPsychology & Behavior","","1094-9313, 1557-8364","10.1089/cpb.2007.0189","http://www.liebertpub.com/doi/10.1089/cpb.2007.0189","","2008-10","2020-06-11 21:55:46","2020-06-11 21:55:46","2020-06-11 21:55:46","565-569","","5","11","","CyberPsychology & Behavior","Internet Embeddedness","","","","","","","en","","","","","DOI.org (Crossref)","","","","","","","","","","","","","","","","","","","","","","","","","","","","","","","","","","","","","","","","","","","","","","","","","","","","",""
"IIUTHIT3","journalArticle","2009","Byun, Sookeun; Ruffini, Celestino; Mills, Juline E.; Douglas, Alecia C.; Niang, Mamadou; Stepchenkova, Svetlana; Lee, Seul Ki; Loutfi, Jihad; Lee, Jung-Kook; Atallah, Mikhail; Blanton, Marina","Internet Addiction: Metasynthesis of 1996–2006 Quantitative Research","CyberPsychology & Behavior","","1094-9313, 1557-8364","10.1089/cpb.2008.0102","http://www.liebertpub.com/doi/10.1089/cpb.2008.0102","","2009-04","2020-06-11 21:55:45","2020-06-11 21:55:45","2020-06-11 21:55:45","203-207","","2","12","","CyberPsychology & Behavior","Internet Addiction","","","","","","","en","","","","","DOI.org (Crossref)","","","","","","","","","","","","","","","","","","","","","","","","","","","","","","","","","","","","","","","","","","","","","","","","","","","","",""
"QTUZMDHD","journalArticle","2007","Ferraro, Giovanni; Caci, Barbara; D'Amico, Antonella; Blasi, Marie Di","Internet Addiction Disorder: An Italian Study","CyberPsychology & Behavior","","1094-9313, 1557-8364","10.1089/cpb.2006.9972","http://www.liebertpub.com/doi/10.1089/cpb.2006.9972","","2007-04","2020-06-11 21:55:44","2020-06-11 21:55:44","2020-06-11 21:55:44","170-175","","2","10","","CyberPsychology & Behavior","Internet Addiction Disorder","","","","","","","en","","","","","DOI.org (Crossref)","","","","","","","","","","","","","","","","","","","","","","","","","","","","","","","","","","","","","","","","","","","","","","","","","","","","",""
"MF4RWCFL","journalArticle","2008","Siomos, Konstantinos E.; Dafouli, Evaggelia D.; Braimiotis, Dimitrios A.; Mouzas, Odysseas D.; Angelopoulos, Nikiforos V.","Internet Addiction among Greek Adolescent Students","CyberPsychology & Behavior","","1094-9313, 1557-8364","10.1089/cpb.2008.0088","http://www.liebertpub.com/doi/10.1089/cpb.2008.0088","","2008-12","2020-06-11 21:55:43","2020-06-11 21:55:43","2020-06-11 21:55:43","653-657","","6","11","","CyberPsychology & Behavior","","","","","","","","en","","","","","DOI.org (Crossref)","","","","","","","","","","","","","","","","","","","","","","","","","","","","","","","","","","","","","","","","","","","","","","","","","","","","",""
"G8F8XW7E","journalArticle","2009","Huang, Hanyun; Leung, Louis","Instant Messaging Addiction among Teenagers in China: Shyness, Alienation, and Academic Performance Decrement","CyberPsychology & Behavior","","1094-9313, 1557-8364","10.1089/cpb.2009.0060","http://www.liebertpub.com/doi/10.1089/cpb.2009.0060","","2009-12","2020-06-11 21:55:42","2020-06-11 21:55:42","2020-06-11 21:55:42","675-679","","6","12","","CyberPsychology & Behavior","Instant Messaging Addiction among Teenagers in China","","","","","","","en","","","","","DOI.org (Crossref)","","","","","","","","","","","","","","","","","","","","","","","","","","","","","","","","","","","","","","","","","","","","","","","","","","","","",""
"YNBKY2NY","journalArticle","2008","Jackson, Linda A.; Fitzgerald, Hiram E.; Zhao, Yong; Kolenic, Anthony; von Eye, Alexander; Harold, Rena","Information Technology (IT) Use and Children's Psychological Well-Being","CyberPsychology & Behavior","","1094-9313, 1557-8364","10.1089/cpb.2008.0035","http://www.liebertpub.com/doi/10.1089/cpb.2008.0035","","2008-12","2020-06-11 21:55:41","2020-06-11 21:55:41","2020-06-11 21:55:41","755-757","","6","11","","CyberPsychology & Behavior","","","","","","","","en","","","","","DOI.org (Crossref)","","","","","","","","","","","","","","","","","","","","","","","","","","","","","","","","","","","","","","","","","","","","","","","","","","","","",""
"CIZHHMSR","journalArticle","2009","Mitchell, Kimberly J.; Sabina, Chiara; Finkelhor, David; Wells, Melissa","Index of Problematic Online Experiences: Item Characteristics and Correlation with Negative Symptomatology","CyberPsychology & Behavior","","1094-9313, 1557-8364","10.1089/cpb.2008.0317","http://www.liebertpub.com/doi/10.1089/cpb.2008.0317","","2009-12","2020-06-11 21:55:39","2020-06-11 21:55:39","2020-06-11 21:55:39","707-711","","6","12","","CyberPsychology & Behavior","Index of Problematic Online Experiences","","","","","","","en","","","","","DOI.org (Crossref)","","","","/Users/dougaparry/Zotero/storage/ACPS2GRA/Mitchell et al. - 2009 - Index of Problematic Online Experiences Item Char.pdf","","","","","","","","","","","","","","","","","","","","","","","","","","","","","","","","","","","","","","","","","","","","","","","","",""
"S3MXJZA3","journalArticle","2007","Bayraktar, Fatih; Gün, Zübeyit","Incidence and Correlates of Internet Usage Among Adolescents in North Cyprus","CyberPsychology & Behavior","","1094-9313, 1557-8364","10.1089/cpb.2006.9969","http://www.liebertpub.com/doi/10.1089/cpb.2006.9969","","2007-04","2020-06-11 21:55:38","2020-06-11 21:55:38","2020-06-11 21:55:38","191-197","","2","10","","CyberPsychology & Behavior","","","","","","","","en","","","","","DOI.org (Crossref)","","","","","","","","","","","","","","","","","","","","","","","","","","","","","","","","","","","","","","","","","","","","","","","","","","","","",""
"UBCDVVBP","journalArticle","2007","Matute, Helena; Vadillo, Miguel A.; Vegas, Sonia; Blanco, Fernando","Illusion of Control in Internet Users and College Students","CyberPsychology & Behavior","","1094-9313, 1557-8364","10.1089/cpb.2006.9971","http://www.liebertpub.com/doi/10.1089/cpb.2006.9971","","2007-04","2020-06-11 21:55:30","2020-06-11 21:55:30","2020-06-11 21:55:30","176-181","","2","10","","CyberPsychology & Behavior","","","","","","","","en","","","","","DOI.org (Crossref)","","","","/Users/dougaparry/Zotero/storage/QNYX66E7/Matute et al. - 2007 - Illusion of Control in Internet Users and College .pdf","","","","","","","","","","","","","","","","","","","","","","","","","","","","","","","","","","","","","","","","","","","","","","","","",""
"5H8BMI7B","journalArticle","2007","Cheuk, W.S.; Chan, Zenobia C.Y.","ICQ (I Seek You) and Adolescents: AQuantitative Study in Hong Kong","CyberPsychology & Behavior","","1094-9313, 1557-8364","10.1089/cpb.2006.9985","http://www.liebertpub.com/doi/10.1089/cpb.2006.9985","","2007-02","2020-06-11 21:55:29","2020-06-11 21:55:29","2020-06-11 21:55:29","108-114","","1","10","","CyberPsychology & Behavior","ICQ (I Seek You) and Adolescents","","","","","","","en","","","","","DOI.org (Crossref)","","","","","","","","","","","","","","","","","","","","","","","","","","","","","","","","","","","","","","","","","","","","","","","","","","","","",""
"8VVV3V5Q","journalArticle","2011","Stefanone, Michael A.; Lackaff, Derek; Rosen, Devan","Contingencies of Self-Worth and Social-Networking-Site Behavior","Cyberpsychology, Behavior, and Social Networking","","2152-2715, 2152-2723","10.1089/cyber.2010.0049","http://www.liebertpub.com/doi/10.1089/cyber.2010.0049","","2011-01","2020-06-16 07:48:45","2020-06-16 07:48:45","2020-06-16 07:48:45","41-49","","1-2","14","","Cyberpsychology, Behavior, and Social Networking","","","","","","","","en","","","","","DOI.org (Crossref)","","","","/Users/dougaparry/Zotero/storage/KHCSQYWT/Stefanone et al_2011_Contingencies of Self-Worth and Social-Networking-Site Behavior.pdf","","","","","","","","","","","","","","","","","","","","","","","","","","","","","","","","","","","","","","","","","","","","","","","","",""
"ATQWLEGC","journalArticle","2017","Hanna, Emily; Ward, L. Monique; Seabrook, Rita C.; Jerald, Morgan; Reed, Lauren; Giaccardi, Soraya; Lippman, Julia R.","Contributions of Social Comparison and Self-Objectification in Mediating Associations Between Facebook Use and Emergent Adults' Psychological Well-Being","Cyberpsychology, Behavior, and Social Networking","","2152-2715, 2152-2723","10.1089/cyber.2016.0247","http://www.liebertpub.com/doi/10.1089/cyber.2016.0247","","2017-03","2020-06-16 07:48:54","2020-06-16 07:48:54","2020-06-16 07:48:54","172-179","","3","20","","Cyberpsychology, Behavior, and Social Networking","","","","","","","","en","","","","","DOI.org (Crossref)","","","","","","","","","","","","","","","","","","","","","","","","","","","","","","","","","","","","","","","","","","","","","","","","","","","","",""
"PEGN7LSB","journalArticle","2007","Madell, Dominic E.; Muncer, Steven J.","Control over Social Interactions: An Important Reason for Young People's Use of the Internet and Mobile Phones for Communication?","CyberPsychology & Behavior","","1094-9313, 1557-8364","10.1089/cpb.2006.9980","http://www.liebertpub.com/doi/10.1089/cpb.2006.9980","","2007-02","2020-06-16 07:48:56","2020-06-16 07:48:56","2020-06-16 07:48:56","137-140","","1","10","","CyberPsychology & Behavior","Control over Social Interactions","","","","","","","en","","","","","DOI.org (Crossref)","","","","","","","","","","","","","","","","","","","","","","","","","","","","","","","","","","","","","","","","","","","","","","","","","","","","",""
"SXEJ3YNH","journalArticle","2017","Keep, Melanie; Attrill-Smith, Alison","Controlling You Watching Me: Measuring Perception Control on Social Media","Cyberpsychology, Behavior, and Social Networking","","2152-2715, 2152-2723","10.1089/cyber.2017.0040","http://www.liebertpub.com/doi/10.1089/cyber.2017.0040","","2017-09","2020-06-16 07:48:58","2020-06-16 07:48:58","2020-06-16 07:48:58","561-566","","9","20","","Cyberpsychology, Behavior, and Social Networking","Controlling You Watching Me","","","","","","","en","","","","","DOI.org (Crossref)","","","","/Users/dougaparry/Zotero/storage/ZJT9J69J/Keep_Attrill-Smith_2017_Controlling You Watching Me.pdf","","","","","","","","","","","","","","","","","","","","","","","","","","","","","","","","","","","","","","","","","","","","","","","","",""
"YY36TJKS","journalArticle","2015","Brunborg, Geir Scott; Hanss, Daniel; Mentzoni, Rune Aune; Pallesen, Ståle","Core and Peripheral Criteria of Video Game Addiction in the Game Addiction Scale for Adolescents","Cyberpsychology, Behavior, and Social Networking","","2152-2715, 2152-2723","10.1089/cyber.2014.0509","http://www.liebertpub.com/doi/10.1089/cyber.2014.0509","","2015-05","2020-06-16 07:49:06","2020-06-16 07:49:06","2020-06-16 07:49:06","280-285","","5","18","","Cyberpsychology, Behavior, and Social Networking","","","","","","","","en","","","","","DOI.org (Crossref)","","","","/Users/dougaparry/Zotero/storage/IN2MXUSU/Brunborg et al_2015_Core and Peripheral Criteria of Video Game Addiction in the Game Addiction.pdf","","","","","","","","","","","","","","","","","","","","","","","","","","","","","","","","","","","","","","","","","","","","","","","","",""
"W4Y2D38S","journalArticle","2017","Shapiro, Gilla K.; Tatar, Ovidiu; Sutton, Arielle; Fisher, William; Naz, Anila; Perez, Samara; Rosberger, Zeev","Correlates of Tinder Use and Risky Sexual Behaviors in Young Adults","Cyberpsychology, Behavior, and Social Networking","","2152-2715, 2152-2723","10.1089/cyber.2017.0279","http://www.liebertpub.com/doi/10.1089/cyber.2017.0279","","2017-12","2020-06-16 07:49:12","2020-06-16 07:49:12","2020-06-16 07:49:12","727-734","","12","20","","Cyberpsychology, Behavior, and Social Networking","","","","","","","","en","","","","","DOI.org (Crossref)","","","","","","","","","","","","","","","","","","","","","","","","","","","","","","","","","","","","","","","","","","","","","","","","","","","","",""
"DYB69VPI","journalArticle","2014","Howard, Matt C.","Creation of a Computer Self-Efficacy Measure: Analysis of Internal Consistency, Psychometric Properties, and Validity","Cyberpsychology, Behavior, and Social Networking","","2152-2715, 2152-2723","10.1089/cyber.2014.0255","http://www.liebertpub.com/doi/10.1089/cyber.2014.0255","","2014-10","2020-06-16 07:49:14","2020-06-16 07:49:14","2020-06-16 07:49:14","677-681","","10","17","","Cyberpsychology, Behavior, and Social Networking","Creation of a Computer Self-Efficacy Measure","","","","","","","en","","","","","DOI.org (Crossref)","","","","","","","","","","","","","","","","","","","","","","","","","","","","","","","","","","","","","","","","","","","","","","","","","","","","",""
"7YSXH3ZD","journalArticle","2019","Lopez-Fernandez, Olatz; Griffiths, Mark D.; Kuss, Daria J.; Dawes, Christopher; Pontes, Halley M.; Justice, Lucy; Rumpf, Hans-Jürgen; Bischof, Anja; Gässler, Ann-Kathrin; Suryani, Eva; Männikkö, Niko; Kääriänen, Maria; Romo, Lucia; Morvan, Yannick; Kern, Laurence; Graziani, Pierluigi; Rousseau, Amélie; Hormes, Julia M.; Schimmenti, Adriano; Passanisi, Alessia; Demetrovics, Zsolt; Király, Orsolya; Lelonek-Kuleta, Bernadeta; Chwaszcz, Joanna; Dufour, Magali; Ponce Terashima, Javier; Chóliz, Mariano; Zacarés, Juan José; Serra, Emilia; Rochat, Lucien; Zullino, Daniele; Achab, Sophia; Landrø, Nils Inge; Billieux, Joël","Cross-Cultural Validation of the Compulsive Internet Use Scale in Four Forms and Eight Languages","Cyberpsychology, Behavior, and Social Networking","","2152-2715, 2152-2723","10.1089/cyber.2018.0731","https://www.liebertpub.com/doi/10.1089/cyber.2018.0731","","2019-07","2020-06-16 07:49:44","2020-06-16 07:49:44","2020-06-16 07:49:44","451-464","","7","22","","Cyberpsychology, Behavior, and Social Networking","","","","","","","","en","","","","","DOI.org (Crossref)","","","","","","","","","","","","","","","","","","","","","","","","","","","","","","","","","","","","","","","","","","","","","","","","","","","","",""
"CEXNMFLI","journalArticle","2019","Błachnio, Agata; Przepiórka, Aneta; Gorbaniuk, Oleg; Benvenuti, Martina; Ciobanu, Adela Magdalena; Senol-Durak, Emre; Durak, Mithat; Giannakos, Michail N.; Mazzoni, Elvis; Pappas, Ilias O.; Popa, Camelia; Seidman, Gwendolyn; Wu, Anise M.S.; Yu, Shu; Ben-Ezra, Menachem","Cultural Correlates of Internet Addiction","Cyberpsychology, Behavior, and Social Networking","","2152-2715, 2152-2723","10.1089/cyber.2018.0667","https://www.liebertpub.com/doi/10.1089/cyber.2018.0667","","2019-04","2020-06-16 07:49:46","2020-06-16 07:49:46","2020-06-16 07:49:46","258-263","","4","22","","Cyberpsychology, Behavior, and Social Networking","","","","","","","","en","","","","","DOI.org (Crossref)","","","","","","","","","","","","","","","","","","","","","","","","","","","","","","","","","","","","","","","","","","","","","","","","","","","","",""
"LX4MQEC7","journalArticle","2007","Recabarren, Matías; Nussbaum, Miguel; Leiva, Claudia","Cultural Illiteracy and the Internet","CyberPsychology & Behavior","","1094-9313, 1557-8364","10.1089/cpb.2007.9940","http://www.liebertpub.com/doi/10.1089/cpb.2007.9940","","2007-12","2020-06-16 07:49:49","2020-06-16 07:49:49","2020-06-16 07:49:49","853-856","","6","10","","CyberPsychology & Behavior","","","","","","","","en","","","","","DOI.org (Crossref)","","","","","","","","","","","","","","","","","","","","","","","","","","","","","","","","","","","","","","","","","","","","","","","","","","","","",""
"I34GRH6E","journalArticle","2014","den Hamer, Anouk; Konijn, Elly A.; Keijer, Micha G.","Cyberbullying Behavior and Adolescents' Use of Media with Antisocial Content: A Cyclic Process Model","Cyberpsychology, Behavior, and Social Networking","","2152-2715, 2152-2723","10.1089/cyber.2012.0307","http://www.liebertpub.com/doi/10.1089/cyber.2012.0307","","2014-02","2020-06-16 07:49:51","2020-06-16 07:49:51","2020-06-16 07:49:51","74-81","","2","17","","Cyberpsychology, Behavior, and Social Networking","Cyberbullying Behavior and Adolescents' Use of Media with Antisocial Content","","","","","","","en","","","","","DOI.org (Crossref)","","","","","","","","","","","","","","","","","","","","","","","","","","","","","","","","","","","","","","","","","","","","","","","","","","","","",""
"ZBJFI57W","journalArticle","2016","Blais-Lecours, Sarah; Vaillancourt-Morel, Marie-Pier; Sabourin, Stéphane; Godbout, Natacha","Cyberpornography: Time Use, Perceived Addiction, Sexual Functioning, and Sexual Satisfaction","Cyberpsychology, Behavior, and Social Networking","","2152-2715, 2152-2723","10.1089/cyber.2016.0364","http://www.liebertpub.com/doi/10.1089/cyber.2016.0364","","2016-11","2020-06-16 07:49:54","2020-06-16 07:49:54","2020-06-16 07:49:54","649-655","","11","19","","Cyberpsychology, Behavior, and Social Networking","Cyberpornography","","","","","","","en","","","","","DOI.org (Crossref)","","","","","","","","","","","","","","","","","","","","","","","","","","","","","","","","","","","","","","","","","","","","","","","","","","","","",""
"SNQM3JJJ","journalArticle","2011","Baiocco, Roberto; Laghi, Fiorenzo; Schneider, Barry H.; Dalessio, Maria; Amichai-Hamburger, Yair; Coplan, Robert J.; Koszycki, Diana; Flament, Martine","Daily Patterns of Communication and Contact Between Italian Early Adolescents and Their Friends","Cyberpsychology, Behavior, and Social Networking","","2152-2715, 2152-2723","10.1089/cyber.2010.0208","http://www.liebertpub.com/doi/10.1089/cyber.2010.0208","","2011-07","2020-06-16 07:49:56","2020-06-16 07:49:56","2020-06-16 07:49:56","467-471","","7-8","14","","Cyberpsychology, Behavior, and Social Networking","","","","","","","","en","","","","","DOI.org (Crossref)","","","","","","","","","","","","","","","","","","","","","","","","","","","","","","","","","","","","","","","","","","","","","","","","","","","","",""
"LVVCTEN5","journalArticle","2014","Tortolero, Susan R.; Peskin, Melissa F.; Baumler, Elizabeth R.; Cuccaro, Paula M.; Elliott, Marc N.; Davies, Susan L.; Lewis, Terri H.; Banspach, Stephen W.; Kanouse, David E.; Schuster, Mark A.","Daily Violent Video Game Playing and Depression in Preadolescent Youth","Cyberpsychology, Behavior, and Social Networking","","2152-2715, 2152-2723","10.1089/cyber.2014.0091","http://www.liebertpub.com/doi/10.1089/cyber.2014.0091","","2014-09","2020-06-16 07:49:58","2020-06-16 07:49:58","2020-06-16 07:49:58","609-615","","9","17","","Cyberpsychology, Behavior, and Social Networking","","","","","","","","en","","","","","DOI.org (Crossref)","","","","/Users/dougaparry/Zotero/storage/EBFLLIZ3/Tortolero et al_2014_Daily Violent Video Game Playing and Depression in Preadolescent Youth.pdf","","","","","","","","","","","","","","","","","","","","","","","","","","","","","","","","","","","","","","","","","","","","","","","","",""
"DYF7WLLG","journalArticle","2016","Friend, Catherine; Fox Hamilton, Nicola","Deception Detection: The Relationship of Levels of Trust and Perspective Taking in Real-Time Online and Offline Communication Environments","Cyberpsychology, Behavior, and Social Networking","","2152-2715, 2152-2723","10.1089/cyber.2015.0643","http://www.liebertpub.com/doi/10.1089/cyber.2015.0643","","2016-09","2020-06-16 07:50:04","2020-06-16 07:50:04","2020-06-16 07:50:04","532-537","","9","19","","Cyberpsychology, Behavior, and Social Networking","Deception Detection","","","","","","","en","","","","","DOI.org (Crossref)","","","","","","","","","","","","","","","","","","","","","","","","","","","","","","","","","","","","","","","","","","","","","","","","","","","","",""
"3Z8S4R6P","journalArticle","2014","Gámez-Guadix, Manuel","Depressive Symptoms and Problematic Internet Use Among Adolescents: Analysis of the Longitudinal Relationships from the Cognitive–Behavioral Model","Cyberpsychology, Behavior, and Social Networking","","2152-2715, 2152-2723","10.1089/cyber.2014.0226","http://www.liebertpub.com/doi/10.1089/cyber.2014.0226","","2014-11","2020-06-16 07:50:06","2020-06-16 07:50:06","2020-06-16 07:50:06","714-719","","11","17","","Cyberpsychology, Behavior, and Social Networking","Depressive Symptoms and Problematic Internet Use Among Adolescents","","","","","","","en","","","","","DOI.org (Crossref)","","","","/Users/dougaparry/Zotero/storage/IPLLJX2F/Gamez-Guadix_2014_Depressive Symptoms and Problematic Internet Use Among Adolescents.pdf","","","","","","","","","","","","","","","","","","","","","","","","","","","","","","","","","","","","","","","","","","","","","","","","",""
"MY68M4SY","journalArticle","2019","Wong, Dorothy; Amon, Krestina L.; Keep, Melanie","Desire to Belong Affects Instagram Behavior and Perceived Social Support","Cyberpsychology, Behavior, and Social Networking","","2152-2715, 2152-2723","10.1089/cyber.2018.0533","https://www.liebertpub.com/doi/10.1089/cyber.2018.0533","","2019-07","2020-06-16 07:50:11","2020-06-16 07:50:11","2020-06-16 07:50:11","465-471","","7","22","","Cyberpsychology, Behavior, and Social Networking","","","","","","","","en","","","","","DOI.org (Crossref)","","","","","","","","","","","","","","","","","","","","","","","","","","","","","","","","","","","","","","","","","","","","","","","","","","","","",""
