"Key","Item Type","Publication Year","Author","Title","Publication Title","ISBN","ISSN","DOI","Url","Abstract Note","Date","Date Added","Date Modified","Access Date","Pages","Num Pages","Issue","Volume","Number Of Volumes","Journal Abbreviation","Short Title","Series","Series Number","Series Text","Series Title","Publisher","Place","Language","Rights","Type","Archive","Archive Location","Library Catalog","Call Number","Extra","Notes","File Attachments","Link Attachments","Manual Tags","Automatic Tags","Editor","Series Editor","Translator","Contributor","Attorney Agent","Book Author","Cast Member","Commenter","Composer","Cosponsor","Counsel","Interviewer","Producer","Recipient","Reviewed Author","Scriptwriter","Words By","Guest","Number","Edition","Running Time","Scale","Medium","Artwork Size","Filing Date","Application Number","Assignee","Issuing Authority","Country","Meeting Name","Conference Name","Court","References","Reporter","Legal Status","Priority Numbers","Programming Language","Version","System","Code","Code Number","Section","Session","Committee","History","Legislative Body"
"3KKGKK8W","journalArticle","2018","Walther, Joseph B.; Kashian, Nicole; Jang, Jeong-Woo; Shin, Soo Yun; Dai, Yue (Nancy); Koutamanis, Maria","The Effect of Message Persistence and Disclosure on Liking in Computer-Mediated Communication","Media Psychology","","1521-3269, 1532-785X","10.1080/15213269.2016.1247718","https://www.tandfonline.com/doi/full/10.1080/15213269.2016.1247718","","2018-04-03","2020-06-05 08:06:25","2020-06-05 08:06:25","2020-06-05 08:06:25","308-327","","2","21","","Media Psychology","","","","","","","","en","","","","","DOI.org (Crossref)","","","","","","","","","","","","","","","","","","","","","","","","","","","","","","","","","","","","","","","","","","","","","","","","","","","","",""
"ZESJECBI","journalArticle","2007","Rockwell, Steven C.; Singleton, Loy A.","The Effect of the Modality of Presentation of Streaming Multimedia on Information Acquisition","Media Psychology","","1521-3269, 1532-785X","10.1080/15213260709336808","http://www.tandfonline.com/doi/abs/10.1080/15213260709336808","","2007-03","2020-06-05 08:06:27","2020-06-05 08:06:27","2020-06-05 08:06:27","179-191","","1","9","","Media Psychology","","","","","","","","en","","","","","DOI.org (Crossref)","","","","","","","","","","","","","","","","","","","","","","","","","","","","","","","","","","","","","","","","","","","","","","","","","","","","",""
"AKBVVKLL","journalArticle","2015","Bond, Bradley J.","The Mediating Role of Self-Discrepancies in the Relationship Between Media Exposure and Well-Being Among Lesbian, Gay, and Bisexual Adolescents","Media Psychology","","1521-3269, 1532-785X","10.1080/15213269.2014.917591","http://www.tandfonline.com/doi/abs/10.1080/15213269.2014.917591","","2015-01-02","2020-06-05 08:06:29","2020-06-05 08:06:29","2020-06-05 08:06:29","51-73","","1","18","","Media Psychology","","","","","","","","en","","","","","DOI.org (Crossref)","","","","","","","","","","","","","","","","","","","","","","","","","","","","","","","","","","","","","","","","","","","","","","","","","","","","",""
"EWC5R49X","journalArticle","2019","Schnauber-Stockmann, Anna; Naab, Teresa K.","The process of forming a mobile media habit: results of a longitudinal study in a real-world setting","Media Psychology","","1521-3269, 1532-785X","10.1080/15213269.2018.1513850","https://www.tandfonline.com/doi/full/10.1080/15213269.2018.1513850","","2019-09-03","2020-06-05 08:06:31","2020-06-05 08:06:31","2020-06-05 08:06:31","714-742","","5","22","","Media Psychology","The process of forming a mobile media habit","","","","","","","en","","","","","DOI.org (Crossref)","","","","","","","","","","","","","","","","","","","","","","","","","","","","","","","","","","","","","","","","","","","","","","","","","","","","",""
"6WLHWIU8","journalArticle","2009","Ravaja, Niklas","The Psychophysiology of Digital Gaming: The Effect of a Non Co-Located Opponent","Media Psychology","","1521-3269, 1532-785X","10.1080/15213260903052240","http://www.tandfonline.com/doi/abs/10.1080/15213260903052240","","2009-08-19","2020-06-05 08:06:35","2020-06-05 08:06:35","2020-06-05 08:06:35","268-294","","3","12","","Media Psychology","The Psychophysiology of Digital Gaming","","","","","","","en","","","","","DOI.org (Crossref)","","","","","","","","","","","","","","","","","","","","","","","","","","","","","","","","","","","","","","","","","","","","","","","","","","","","",""
"75GQMXNF","journalArticle","2017","Vangeel, Jolien; Beullens, Kathleen; Vervoort, Leentje; Cock, Nathalie De; Lippevelde, Wendy Van; Goossens, Lien; Eggermont, Steven","The Role Behavioral of Activation and Inhibition in Explaining Adolescents’ Game Use and Game Engagement Levels","Media Psychology","","1521-3269, 1532-785X","10.1080/15213269.2016.1142378","https://www.tandfonline.com/doi/full/10.1080/15213269.2016.1142378","","2017-01-02","2020-06-05 08:06:37","2020-06-05 08:06:37","2020-06-05 08:06:37","116-143","","1","20","","Media Psychology","","","","","","","","en","","","","","DOI.org (Crossref)","","","","","","","","","","","","","","","","","","","","","","","","","","","","","","","","","","","","","","","","","","","","","","","","","","","","",""
"25TXFS3E","journalArticle","2016","Fikkers, Karin M.; Piotrowski, Jessica Taylor; Lugtig, Peter; Valkenburg, Patti M.","The Role of Perceived Peer Norms in the Relationship Between Media Violence Exposure and Adolescents' Aggression","Media Psychology","","1521-3269, 1532-785X","10.1080/15213269.2015.1037960","http://www.tandfonline.com/doi/full/10.1080/15213269.2015.1037960","","2016-01-02","2020-06-05 08:06:40","2020-06-05 08:06:40","2020-06-05 08:06:40","4-26","","1","19","","Media Psychology","","","","","","","","en","","","","","DOI.org (Crossref)","","","","/Users/dougaparry/Zotero/storage/TEXLY73R/Fikkers et al_2016_The Role of Perceived Peer Norms in the Relationship Between Media Violence.pdf","","","","","","","","","","","","","","","","","","","","","","","","","","","","","","","","","","","","","","","","","","","","","","","","",""
"5HRWR8HM","journalArticle","2019","Hwang, Yoori; Jeong, Se-Hoon","The role of user control in media multitasking effects","Media Psychology","","1521-3269, 1532-785X","10.1080/15213269.2019.1659152","https://www.tandfonline.com/doi/full/10.1080/15213269.2019.1659152","","2019-08-27","2020-06-05 08:06:46","2020-06-05 08:06:46","2020-06-05 08:06:46","1-30","","","","","Media Psychology","","","","","","","","en","","","","","DOI.org (Crossref)","","","","","","","","","","","","","","","","","","","","","","","","","","","","","","","","","","","","","","","","","","","","","","","","","","","","",""
"DZK83NAH","journalArticle","2016","Reeves, Byron; Yeykelis, Leo; Cummings, James J.","The Use of Media in Media Psychology","Media Psychology","","1521-3269, 1532-785X","10.1080/15213269.2015.1030083","http://www.tandfonline.com/doi/full/10.1080/15213269.2015.1030083","","2016-01-02","2020-06-05 08:06:49","2020-06-05 08:06:49","2020-06-05 08:06:49","49-71","","1","19","","Media Psychology","","","","","","","","en","","","","","DOI.org (Crossref)","","","","","","","","","","","","","","","","","","","","","","","","","","","","","","","","","","","","","","","","","","","","","","","","","","","","",""
"IAXHHMWX","journalArticle","2013","McGloin, Rory; Farrar, Kirstie; Krcmar, Marina","Video Games, Immersion, and Cognitive Aggression: Does the Controller Matter?","Media Psychology","","1521-3269, 1532-785X","10.1080/15213269.2012.752428","http://www.tandfonline.com/doi/abs/10.1080/15213269.2012.752428","","2013-01","2020-06-05 08:06:52","2020-06-05 08:06:52","2020-06-05 08:06:51","65-87","","1","16","","Media Psychology","Video Games, Immersion, and Cognitive Aggression","","","","","","","en","","","","","DOI.org (Crossref)","","","","","","","","","","","","","","","","","","","","","","","","","","","","","","","","","","","","","","","","","","","","","","","","","","","","",""
"YGVT7FMP","journalArticle","2017","Chang, Yuhmiin","Why Do Young People Multitask With Multiple Media? Explicating the Relationships Among Sensation Seeking, Needs, and Media Multitasking Behavior","Media Psychology","","1521-3269, 1532-785X","10.1080/15213269.2016.1247717","https://www.tandfonline.com/doi/full/10.1080/15213269.2016.1247717","","2017-10-02","2020-06-05 08:06:54","2020-06-05 08:06:54","2020-06-05 08:06:54","685-703","","4","20","","Media Psychology","Why Do Young People Multitask With Multiple Media?","","","","","","","en","","","","","DOI.org (Crossref)","","","","","","","","","","","","","","","","","","","","","","","","","","","","","","","","","","","","","","","","","","","","","","","","","","","","",""
"DBVPTY2I","journalArticle","2019","Pieschl, Stephanie","Will using the Internet to answer knowledge questions increase users’ overestimation of their own ability or performance?","Media Psychology","","1521-3269, 1532-785X","10.1080/15213269.2019.1668810","https://www.tandfonline.com/doi/full/10.1080/15213269.2019.1668810","","2019-09-24","2020-06-05 08:06:56","2020-06-05 08:06:56","2020-06-05 08:06:56","1-27","","","","","Media Psychology","","","","","","","","en","","","","","DOI.org (Crossref)","","","","","","","","","","","","","","","","","","","","","","","","","","","","","","","","","","","","","","","","","","","","","","","","","","","","",""
"V2HG56QL","journalArticle","2007","Lee, Eun-Ju","Wired for Gender: Experientiality and Gender-Stereotyping in Computer-Mediated Communication","Media Psychology","","1521-3269, 1532-785X","10.1080/15213260701375595","http://www.tandfonline.com/doi/abs/10.1080/15213260701375595","","2007-06-29","2020-06-05 08:06:58","2020-06-05 08:06:58","2020-06-05 08:06:58","182-210","","2","10","","Media Psychology","Wired for Gender","","","","","","","en","","","","","DOI.org (Crossref)","","","","","","","","","","","","","","","","","","","","","","","","","","","","","","","","","","","","","","","","","","","","","","","","","","","","",""
"2MLFP62T","journalArticle","2010","Walther, Joseph B.; Deandrea, David C.; Tong, Stephanie Tom","Computer-Mediated Communication Versus Vocal Communication and the Attenuation of Pre-Interaction Impressions","Media Psychology","","1521-3269, 1532-785X","10.1080/15213269.2010.524913","http://www.tandfonline.com/doi/abs/10.1080/15213269.2010.524913","","2010-11-30","2020-06-05 12:20:16","2020-06-05 12:20:16","2020-06-05 12:20:16","364-386","","4","13","","Media Psychology","","","","","","","","en","","","","","DOI.org (Crossref)","","","","","","","","","","","","","","","","","","","","","","","","","","","","","","","","","","","","","","","","","","","","","","","","","","","","",""
"Y29DIFNI","journalArticle","2008","Bartsch, Anne; Vorderer, Peter; Mangold, Roland; Viehoff, Reinhold","Appraisal of Emotions in Media Use: Toward a Process Model of Meta-Emotion and Emotion Regulation","Media Psychology","","1521-3269, 1532-785X","10.1080/15213260701813447","http://www.tandfonline.com/doi/abs/10.1080/15213260701813447","","2008-03-21","2020-06-05 12:20:13","2020-06-05 12:20:13","2020-06-05 12:20:13","7-27","","1","11","","Media Psychology","Appraisal of Emotions in Media Use","","","","","","","en","","","","","DOI.org (Crossref)","","","","/Users/dougaparry/Zotero/storage/7BAW2NTM/Bartsch et al. - 2008 - Appraisal of Emotions in Media Use Toward a Proce.pdf","","","","","","","","","","","","","","","","","","","","","","","","","","","","","","","","","","","","","","","","","","","","","","","","",""
"LFZEZKEV","journalArticle","2015","Krcmar, Marina; Farrar, Kirstie M.; Jalette, Gerard; McGloin, Rory","Appetitive and Defensive Arousal in Violent Video Games: Explaining Individual Differences in Attraction to and Effects of Video Games","Media Psychology","","1521-3269, 1532-785X","10.1080/15213269.2014.888007","http://www.tandfonline.com/doi/full/10.1080/15213269.2014.888007","","2015-10-02","2020-06-05 12:20:09","2020-06-05 12:20:09","2020-06-05 12:20:09","527-550","","4","18","","Media Psychology","Appetitive and Defensive Arousal in Violent Video Games","","","","","","","en","","","","","DOI.org (Crossref)","","","","","","","","","","","","","","","","","","","","","","","","","","","","","","","","","","","","","","","","","","","","","","","","","","","","",""
"XGTRDKER","journalArticle","2009","Krcmar, Marina; Lachlan, Kenneth","Aggressive Outcomes and Videogame Play: The Role of Length of Play and the Mechanisms at Work","Media Psychology","","1521-3269, 1532-785X","10.1080/15213260903052257","http://www.tandfonline.com/doi/abs/10.1080/15213260903052257","","2009-08-19","2020-06-05 12:20:08","2020-06-05 12:20:08","2020-06-05 12:20:08","249-267","","3","12","","Media Psychology","Aggressive Outcomes and Videogame Play","","","","","","","en","","","","","DOI.org (Crossref)","","","","","","","","","","","","","","","","","","","","","","","","","","","","","","","","","","","","","","","","","","","","","","","","","","","","",""
"AP6UR23A","journalArticle","2019","Paez, Dario; Delfino, Gisela; Vargas-Salfate, Salvador; Liu, James H.; Gil De Zúñiga, Homero; Khan, Sammyh; Garaigordobil, Maite","A longitudinal study of the effects of internet use on subjective well-being","Media Psychology","","1521-3269, 1532-785X","10.1080/15213269.2019.1624177","https://www.tandfonline.com/doi/full/10.1080/15213269.2019.1624177","","2019-08-22","2020-06-05 12:20:07","2020-06-05 12:20:07","2020-06-05 12:20:07","1-35","","","","","Media Psychology","","","","","","","","en","","","","","DOI.org (Crossref)","","","","","","","","","","","","","","","","","","","","","","","","","","","","","","","","","","","","","","","","","","","","","","","","","","","","",""
"HT7KK79R","journalArticle","2018","Domahidi, Emese; Breuer, Johannes; Kowert, Rachel; Festl, Ruth; Quandt, Thorsten","A Longitudinal Analysis of Gaming- and Non-Gaming-Related Friendships and Social Support among Social Online Game Players","Media Psychology","","1521-3269, 1532-785X","10.1080/15213269.2016.1257393","https://www.tandfonline.com/doi/full/10.1080/15213269.2016.1257393","","2018-04-03","2020-06-05 12:20:05","2020-06-05 12:20:05","2020-06-05 12:20:05","288-307","","2","21","","Media Psychology","","","","","","","","en","","","","","DOI.org (Crossref)","","","","","","","","","","","","","","","","","","","","","","","","","","","","","","","","","","","","","","","","","","","","","","","","","","","","",""
"PCHP4DZ5","journalArticle","2016","Beullens, Kathleen; Vandenbosch, Laura","A Conditional Process Analysis on the Relationship Between the Use of Social Networking Sites, Attitudes, Peer Norms, and Adolescents' Intentions to Consume Alcohol","Media Psychology","","1521-3269, 1532-785X","10.1080/15213269.2015.1049275","http://www.tandfonline.com/doi/full/10.1080/15213269.2015.1049275","","2016-04-02","2020-06-05 12:20:02","2020-06-05 12:20:02","2020-06-05 12:20:02","310-333","","2","19","","Media Psychology","","","","","","","","en","","","","","DOI.org (Crossref)","","","","","","","","","","","","","","","","","","","","","","","","","","","","","","","","","","","","","","","","","","","","","","","","","","","","",""
"X3G3MZRK","journalArticle","2007","David Acevedo-Polakovich, Ignacio; Lorch, Elizabeth Pugzles; Milich, Richard","Comparing Television Use and Reading in Children With ADHD and Non-Referred Children Across Two Age Groups","Media Psychology","","1521-3269, 1532-785X","10.1080/15213260701291387","http://www.tandfonline.com/doi/abs/10.1080/15213260701291387","","2007-04-13","2020-06-05 12:23:56","2020-06-05 12:23:56","2020-06-05 12:23:56","447-472","","2","9","","Media Psychology","","","","","","","","en","","","","","DOI.org (Crossref)","","","","","","","","","","","","","","","","","","","","","","","","","","","","","","","","","","","","","","","","","","","","","","","","","","","","",""
"9ALQKRJZ","journalArticle","2013","Ward, L. Monique; Carlson, Corissa","Modeling Meanness: Associations Between Reality TV Consumption, Perceived Realism, and Adolescents' Social Aggression","Media Psychology","","1521-3269, 1532-785X","10.1080/15213269.2013.832627","http://www.tandfonline.com/doi/abs/10.1080/15213269.2013.832627","","2013-10","2020-06-11 22:03:04","2020-06-11 22:03:04","2020-06-11 22:03:04","371-389","","4","16","","Media Psychology","Modeling Meanness","","","","","","","en","","","","","DOI.org (Crossref)","","","","","","","","","","","","","","","","","","","","","","","","","","","","","","","","","","","","","","","","","","","","","","","","","","","","",""
"PJPXEMLJ","journalArticle","2019","Wang, Xinghua","Mobile SNS Addiction as A Learned Behavior: A Perspective from Learning Theory","Media Psychology","","1521-3269, 1532-785X","10.1080/15213269.2019.1605912","https://www.tandfonline.com/doi/full/10.1080/15213269.2019.1605912","","2019-05","2020-06-11 22:03:03","2020-06-11 22:03:03","2020-06-11 22:03:03","1-32","","","","","Media Psychology","Mobile SNS Addiction as A Learned Behavior","","","","","","","en","","","","","DOI.org (Crossref)","","","","","","","","","","","","","","","","","","","","","","","","","","","","","","","","","","","","","","","","","","","","","","","","","","","","",""
"ZZZQWW3H","journalArticle","2007","Jordan, Amy; Trentacoste, Nicole; Henderson, Vani; Manganello, Jennifer; Fishbein, Martin","Measuring the Time Teens Spend with Media: Challenges and Opportunities","Media Psychology","","1521-3269, 1532-785X","10.1080/15213260709336801","http://www.tandfonline.com/doi/abs/10.1080/15213260709336801","","2007-03","2020-06-11 22:03:02","2020-06-11 22:03:02","2020-06-11 22:03:02","19-41","","1","9","","Media Psychology","Measuring the Time Teens Spend with Media","","","","","","","en","","","","","DOI.org (Crossref)","","","","","","","","","","","","","","","","","","","","","","","","","","","","","","","","","","","","","","","","","","","","","","","","","","","","",""
"R3NSEVEL","journalArticle","2015","Trepte, Sabine; Dienlin, Tobias; Reinecke, Leonard","Influence of Social Support Received in Online and Offline Contexts on Satisfaction With Social Support and Satisfaction With Life: A Longitudinal Study","Media Psychology","","1521-3269, 1532-785X","10.1080/15213269.2013.838904","http://www.tandfonline.com/doi/abs/10.1080/15213269.2013.838904","","2015-01-02","2020-06-11 22:03:01","2020-06-11 22:03:01","2020-06-11 22:03:01","74-105","","1","18","","Media Psychology","Influence of Social Support Received in Online and Offline Contexts on Satisfaction With Social Support and Satisfaction With Life","","","","","","","en","","","","","DOI.org (Crossref)","","","","","","","","","","","","","","","","","","","","","","","","","","","","","","","","","","","","","","","","","","","","","","","","","","","","",""
"GSHWH9BB","journalArticle","2018","Tokunaga, Robert S.; Quick, Justice D.","Impressions on Social Networking Sites: Examining the Influence of Frequency of Status Updates and Likes on Judgments of Observers","Media Psychology","","1521-3269, 1532-785X","10.1080/15213269.2017.1282874","https://www.tandfonline.com/doi/full/10.1080/15213269.2017.1282874","","2018-04-03","2020-06-11 22:03:00","2020-06-11 22:03:00","2020-06-11 22:03:00","157-181","","2","21","","Media Psychology","Impressions on Social Networking Sites","","","","","","","en","","","","","DOI.org (Crossref)","","","","","","","","","","","","","","","","","","","","","","","","","","","","","","","","","","","","","","","","","","","","","","","","","","","","",""
"CWAWU6PG","journalArticle","2017","Liebold, Benny; Brill, Michael; Pietschmann, Daniel; Schwab, Frank; Ohler, Peter","Continuous Measurement of Breaks in Presence: Psychophysiology and Orienting Responses","Media Psychology","","1521-3269, 1532-785X","10.1080/15213269.2016.1206829","https://www.tandfonline.com/doi/full/10.1080/15213269.2016.1206829","","2017-07-03","2020-06-16 07:44:52","2020-06-16 07:44:52","2020-06-16 07:44:52","477-501","","3","20","","Media Psychology","Continuous Measurement of Breaks in Presence","","","","","","","en","","","","","DOI.org (Crossref)","","","","","","","","","","","","","","","","","","","","","","","","","","","","","","","","","","","","","","","","","","","","","","","","","","","","",""
"F8YHQZBD","journalArticle","2018","Gilbert, Michael A.; Giaccardi, Soraya; Ward, L. Monique","Contributions of Game Genre and Masculinity Ideologies to Associations Between Video Game Play and Men’s Risk-Taking Behavior","Media Psychology","","1521-3269, 1532-785X","10.1080/15213269.2018.1450153","https://www.tandfonline.com/doi/full/10.1080/15213269.2018.1450153","","2018-07-03","2020-06-16 07:44:54","2020-06-16 07:44:54","2020-06-16 07:44:54","437-456","","3","21","","Media Psychology","","","","","","","","en","","","","","DOI.org (Crossref)","","","","","","","","","","","","","","","","","","","","","","","","","","","","","","","","","","","","","","","","","","","","","","","","","","","","",""
"ZQSJV5PX","journalArticle","2011","Jensen, Jakob D.; Weaver, Andrew J.; Ivic, Rebecca; Imboden, Kristen","Developing a Brief Sensation Seeking Scale for Children: Establishing Concurrent Validity With Video Game Use and Rule-Breaking Behavior","Media Psychology","","1521-3269, 1532-785X","10.1080/15213269.2010.547831","http://www.tandfonline.com/doi/abs/10.1080/15213269.2010.547831","","2011-03-09","2020-06-16 07:44:57","2020-06-16 07:44:57","2020-06-16 07:44:57","71-95","","1","14","","Media Psychology","Developing a Brief Sensation Seeking Scale for Children","","","","","","","en","","","","","DOI.org (Crossref)","","","","","","","","","","","","","","","","","","","","","","","","","","","","","","","","","","","","","","","","","","","","","","","","","","","","",""
"58I4IWXG","journalArticle","2009","Lemmens, Jeroen S.; Valkenburg, Patti M.; Peter, Jochen","Development and Validation of a Game Addiction Scale for Adolescents","Media Psychology","","1521-3269, 1532-785X","10.1080/15213260802669458","http://www.tandfonline.com/doi/abs/10.1080/15213260802669458","","2009-02-26","2020-06-16 07:45:00","2020-06-16 07:45:00","2020-06-16 07:45:00","77-95","","1","12","","Media Psychology","","","","","","","","en","","","","","DOI.org (Crossref)","","","","","","","","","","","","","","","","","","","","","","","","","","","","","","","","","","","","","","","","","","","","","","","","","","","","",""
"ZRAIZQST","journalArticle","2020","Winter, Stephan","Do anticipated Facebook discussions diminish the importance of argument quality? An experimental investigation of attitude formation in social media","Media Psychology","","1521-3269, 1532-785X","10.1080/15213269.2019.1572521","https://www.tandfonline.com/doi/full/10.1080/15213269.2019.1572521","","2020-01-02","2020-06-16 07:45:02","2020-06-16 07:45:02","2020-06-16 07:45:02","79-106","","1","23","","Media Psychology","Do anticipated Facebook discussions diminish the importance of argument quality?","","","","","","","en","","","","","DOI.org (Crossref)","","","","","","","","","","","","","","","","","","","","","","","","","","","","","","","","","","","","","","","","","","","","","","","","","","","","",""
"34NU4LFN","journalArticle","2017","Erreygers, Sara; Vandebosch, Heidi; Vranjes, Ivana; Baillien, Elfi; De Witte, Hans","Nice or Naughty? The Role of Emotions and Digital Media Use in Explaining Adolescents’ Online Prosocial and Antisocial Behavior","Media Psychology","","1521-3269, 1532-785X","10.1080/15213269.2016.1200990","https://www.tandfonline.com/doi/full/10.1080/15213269.2016.1200990","","2017-07-03","2020-06-16 18:31:05","2020-06-16 18:31:05","2020-06-16 18:31:05","374-400","","3","20","","Media Psychology","Nice or Naughty?","","","","","","","en","","","","","DOI.org (Crossref)","","","","","","","","","","","","","","","","","","","","","","","","","","","","","","","","","","","","","","","","","","","","","","","","","","","","",""